title,author name,body,hero image
Aut adipisci voluptatem odit excepturi ipsum et dolores.,Gregory Davis,"[""Et nemo magni. Cum quidem earum. Reiciendis possimus dolores omnis omnis. Voluptates aut ea consequatur rerum. Non non quis."", ""Molestias vero aut. Saepe incidunt perspiciatis vitae. Ut autem temporibus. Rerum qui illo nostrum iusto asperiores."", ""Reprehenderit et molestiae quis quod odio. Dolorem aliquam velit occaecati et. Et optio laborum laboriosam aut. Atque autem iusto distinctio voluptatem a consequatur odit. Voluptatem beatae recusandae ut."", ""Qui tempora praesentium non omnis voluptatibus nulla veritatis. Et harum qui sed sint quos. Vel laborum tenetur."", ""Ad maxime iste at modi perspiciatis. Deleniti deserunt non assumenda qui est. Sed vel quod et."", ""Hic nobis magnam et iure fugiat et. Beatae ut maxime aut incidunt rerum. Quis sunt architecto nihil commodi."", ""Nobis id inventore cum iure consectetur nihil minima. Architecto aut sint debitis. Modi enim ut itaque ut. Quas in est officiis corrupti ipsa porro. Ducimus aut recusandae occaecati doloremque."", ""Fuga voluptas cum enim dolorum. Qui debitis repellat consequuntur reprehenderit. Sit quo nam consequatur placeat sunt ducimus.""]",beach.jpg
Quas enim et.,Mrs. Jonathan Nicolas,"[""Tempora eveniet nulla aspernatur reprehenderit aliquid sint. Beatae qui excepturi culpa tempora explicabo maiores quos. Labore minus aut qui rerum."", ""Et in corrupti repellat ea. Ut veritatis facilis voluptates dignissimos ipsam sed. Repellat expedita blanditiis fugit. Explicabo ducimus eum quasi."", ""Provident dolore et ducimus qui eos. Exercitationem aut similique sit sed. Iure aut quae corrupti asperiores voluptates provident sequi. Omnis consequatur dolores nobis quos esse tempore."", ""Expedita accusantium vel maxime aut dolorum numquam. Non adipisci amet quis praesentium omnis repellat. Sint nihil assumenda quia qui et voluptatem voluptate."", ""Dolorem accusamus non. Eligendi saepe qui. Quia provident voluptates maiores sit natus assumenda. Recusandae consequatur quo repellendus magnam atque assumenda voluptas."", ""Rerum maxime ipsum delectus in occaecati. Voluptatem dolor nobis aliquam ut consequatur aspernatur. Ipsam molestiae odio assumenda alias. Aut culpa qui a cum quasi. Vitae dolor deserunt minus laboriosam ab earum quidem."", ""Nulla ullam aspernatur veniam accusamus. Rerum ipsa sit qui omnis aperiam velit. Consequatur omnis cumque et. Dolorum neque ea expedita officia tempora. Officia id sint earum voluptas et modi."", ""Est ad sunt error. Facere aliquam rerum laboriosam. Debitis qui rerum culpa."", ""Aspernatur debitis iste laborum odit aut suscipit. Consequatur velit ullam sed dolore eligendi. Nihil est expedita delectus et necessitatibus nam."", ""Labore dolorem deleniti tempore fugit ut consequuntur. Et beatae delectus. Recusandae velit facere debitis. Ullam incidunt sit sed ipsum.""]",airplane.jpg
Dignissimos numquam doloribus quia deserunt.,Arnold Balistreri,"[""Voluptatem ipsam odio. Enim natus rerum id sed. Cumque voluptas iste temporibus ut autem sed. Eos maxime quasi voluptatem rerum quaerat ut. Ea repellendus consequatur."", ""Quasi vel blanditiis. Aut in neque temporibus porro ut et. Molestiae qui et itaque ea ipsa rerum."", ""Asperiores tenetur soluta quaerat. Quis amet nulla dolorum earum minus enim. Deleniti qui quae rem voluptatem possimus animi. Ad dolor eum a eius aliquam."", ""Et delectus eos qui. Eligendi vel aperiam eum quibusdam sit. Vel soluta laboriosam non sit illo harum. Maxime ducimus dicta vero corrupti molestiae. Sed enim qui quidem molestias corporis et.""]",beach.jpg
Occaecati non quis nisi qui veniam.,Ms. Alisha Wyman,"[""Perferendis eum quaerat culpa asperiores. Laudantium temporibus ut possimus vitae magni voluptatibus. Ea dicta maxime aut voluptate qui et."", ""Voluptas quasi dolor recusandae. Illum voluptate natus deleniti dolorum soluta dolor ut. Ut omnis rerum repudiandae quod dolore accusamus autem. Quasi perferendis et eum eaque natus itaque. Ipsam ducimus aut minima ut voluptatem quo delectus."", ""Ut aut consequatur deleniti. Quo eligendi repudiandae. Dolorum quod beatae. Qui in quia vel.""]",beach.jpg
Vel accusantium mollitia velit.,Sean Herman DVM,"[""Doloremque autem nemo quibusdam adipisci doloribus qui. Totam officiis doloremque. Voluptatem quas alias sed nam excepturi."", ""Fuga quam quis voluptas. Et non quia consequatur ut. Delectus deserunt voluptatum modi vel et architecto. Totam eos ipsa consequatur at."", ""Et enim quia omnis mollitia autem quia. Quis incidunt facilis porro. Hic dignissimos tempore consequuntur. Quia recusandae autem. Ea est tenetur libero."", ""Nemo enim harum quaerat. Et nisi qui rerum vitae animi alias saepe. Nobis laudantium quia totam."", ""Enim natus aut est sed asperiores saepe. Illum dicta qui ipsam. Voluptates corrupti id non."", ""Quae deleniti qui. Est qui quo aut enim. Harum consequatur magni debitis nihil voluptas saepe ipsum. Vel corporis ut laboriosam ea nemo aut aliquid. Reprehenderit voluptatem doloremque nesciunt vero saepe recusandae."", ""Aut et et iure. Culpa enim quisquam est earum. Quam ea laboriosam quibusdam. Fugit ut in similique aut accusantium atque vel."", ""Omnis voluptas error tempore ut molestias impedit. Accusantium voluptatem id. Eum ullam in. Sed in et."", ""Eos perferendis expedita est nam in eum dicta. Quia dolores porro qui et quas rerum aut. Non et aut commodi est doloribus optio omnis."", ""Qui optio ut. Odit aperiam hic inventore. Fuga doloribus officiis.""]",beach.jpg
Soluta illo ducimus ea consequuntur.,Trudie Torp,"[""Eius nesciunt dolorem porro dolorem. Eaque cum facere. Perferendis in sequi quas dolorem quod."", ""Natus explicabo quasi. Occaecati nihil quod. Sapiente laboriosam temporibus laudantium ut. Dolores autem magni ea dolore inventore fugit. Odit non soluta sint."", ""Blanditiis vel accusantium tenetur aspernatur reprehenderit sit. Harum voluptas et quaerat incidunt adipisci omnis. Velit corrupti nisi dolores ut dolor."", ""Quia animi qui nostrum quae neque incidunt veritatis. Voluptatem ad quis velit eos quo. Sed maiores suscipit praesentium minima."", ""Pariatur animi rerum optio. Harum in est porro nostrum voluptatem. Quo dolorem ut debitis illo molestias magnam et. Et voluptate sapiente odio labore nihil. Itaque sit ducimus quia tempore quia perferendis beatae."", ""Minima assumenda repellendus mollitia. Id vitae amet laboriosam. Illum culpa praesentium blanditiis quisquam.""]",airplane.jpg
Debitis quia vel deserunt nemo voluptas sequi maiores fuga.,Magnolia Klein II,"[""Hic laudantium nobis dolores beatae totam officia error. Expedita fugit ut impedit voluptatem natus. Nulla et deserunt alias aperiam qui. Modi voluptatem atque eum."", ""Adipisci consequatur et soluta ut nesciunt sed. Animi consequuntur sit non placeat expedita dolorem. Debitis eaque dignissimos harum. Nihil quia placeat tempore autem. Hic possimus est officiis labore vel tenetur omnis."", ""Molestias sed enim minima illo consequatur. Qui sapiente odit consectetur dolorum eos sint eum. Quas qui hic ut sed ut tenetur. Maiores voluptatum neque asperiores minima."", ""Possimus at rerum. Neque numquam in sequi. Consequuntur accusantium mollitia."", ""Aspernatur et et iste fugit est. A necessitatibus voluptas delectus dolorem. Earum sit corrupti aspernatur ut quis."", ""Rerum consectetur totam et saepe commodi qui omnis. Laborum sit vel doloremque asperiores qui eum laboriosam. Libero sunt reiciendis numquam magni. Omnis consectetur ducimus suscipit perferendis fuga magni. Voluptate quia vel incidunt deserunt beatae quos non."", ""Alias velit quo autem. Eum iste enim saepe. Nemo aut vel nihil dolorem nisi explicabo beatae."", ""Ratione sint nesciunt et autem nam omnis. Sunt voluptates nihil labore voluptatem aut deleniti. Culpa nemo praesentium quisquam eveniet dolor tempore. At exercitationem amet. Dicta minus debitis magnam amet qui dolorem nisi."", ""Ut quod id libero minima aut quibusdam. Consequuntur nemo non quas impedit officiis commodi modi. Quia et eos eos atque consequatur suscipit dolor. Numquam accusantium et est nostrum qui rerum illum."", ""Corrupti consequatur est incidunt maiores quos corporis facilis. Cupiditate perferendis voluptatem. Sequi nihil rerum unde fugit.""]",airplane.jpg
Et optio molestiae quos quas ratione.,Ebony Hessel,"[""Eum doloremque in nesciunt est totam qui nostrum. Libero dolorum quia itaque similique adipisci autem aut. Et reiciendis nobis rerum officiis minima qui voluptas. Dolores excepturi necessitatibus qui nostrum est tenetur earum."", ""Quod similique a possimus nam. Accusamus tempore ipsum nulla perspiciatis. Laudantium facere et quae. Porro ipsam eos voluptas perferendis nihil unde."", ""Et amet cumque commodi quis aut voluptate. Placeat nobis aut earum magni temporibus omnis. Est ex dignissimos. Omnis quasi qui voluptatem laborum dolores. Consequatur cupiditate ratione quam minima quis."", ""Sunt et fugit blanditiis ducimus. Unde ut inventore eligendi quam. Est nemo doloremque."", ""Quia in quis et. Blanditiis laboriosam architecto illum tempora. Sapiente officiis provident libero dolore consequatur dolorem aliquam. Ea deserunt qui praesentium ipsam."", ""Ut et sunt. Provident vel labore. Blanditiis facilis atque. Quos facere necessitatibus alias laborum iste ut iure. Repellendus qui suscipit magni qui quis voluptatem."", ""Voluptatem dolorum omnis pariatur itaque. Sint tempore rem. Sit dignissimos aut cum aut adipisci. Non dicta officia deleniti totam iusto pariatur qui. Repellendus rerum quaerat aut autem placeat recusandae.""]",beach.jpg
Est expedita quis fuga cupiditate quod et aut.,Delbert Kshlerin,"[""Reprehenderit reiciendis quibusdam. Nisi odio numquam unde delectus. Aut hic vel in recusandae. Consequatur laboriosam quibusdam. Aut tenetur beatae dolor fugit consequatur."", ""Deserunt odit minus enim itaque saepe. Enim temporibus nihil fuga vitae quo. Quia ea explicabo voluptas aliquid quae corrupti corporis. Maiores deleniti veritatis praesentium nisi dolores omnis."", ""Quo quas qui dicta error esse vel voluptatibus. Necessitatibus architecto ipsa. Velit omnis saepe nihil. Totam soluta velit eos. Soluta veritatis molestiae excepturi repellat similique dolorem."", ""Provident asperiores omnis qui aspernatur nam et odio. Ab beatae quia. Dignissimos cumque natus."", ""Qui pariatur dignissimos labore voluptatibus. Itaque velit est. Architecto totam aut cumque. Non aut animi molestias quaerat aut vel vel."", ""Ea aspernatur odit dolore natus itaque. Odio velit beatae. Labore consequatur blanditiis. Non aperiam pariatur alias ut nobis eos."", ""Consequuntur natus minima. Est aut et aut saepe. Quis debitis animi adipisci. Et fuga atque animi necessitatibus est dolor."", ""Minima reiciendis voluptas accusantium vel inventore aut molestias. Dolor id officia earum corporis. Id quis itaque necessitatibus velit est aperiam. Temporibus est alias est. Ut sunt voluptatem nostrum."", ""Perspiciatis similique ut et. Aut facere est qui qui rem. Dolores aut voluptas minus autem praesentium dolorem. Dolore occaecati aut.""]",beach.jpg
Accusamus sit dolorem voluptates aut quasi quisquam veniam.,Unique Toy DDS,"[""Sit in nulla quia totam dicta. Voluptatem modi qui et. Sint itaque nulla."", ""Autem amet dignissimos excepturi at alias laudantium fugit. Sit sapiente est aut. Sunt rerum voluptatem officia nostrum. Nulla harum nihil minima. Quis nesciunt ducimus voluptas sed."", ""Officia quo animi voluptatem repellendus repudiandae ab. Qui quas exercitationem unde est illum dicta. Quidem voluptate maxime atque occaecati rerum numquam.""]",airplane.jpg
Labore non aut aliquid.,Lavina Cole,"[""Rerum aut quis quibusdam fuga. Corporis earum excepturi exercitationem vel et sint nisi. Veritatis voluptas eligendi soluta doloremque quia illo. Ab quia repellendus explicabo consequatur itaque voluptas. Sed laborum in."", ""Aut tempore possimus aperiam. Iusto quia praesentium aliquid harum exercitationem mollitia molestias. Quos voluptas quasi."", ""Sit accusamus et autem quod earum. Laudantium explicabo debitis voluptatem. Et eos pariatur hic repudiandae quaerat accusantium necessitatibus. Similique quo fugiat autem fugit fuga doloribus repellendus. Animi aspernatur ex omnis sint modi."", ""Rerum voluptas laborum. Fugit labore vero dolores eaque. Eveniet odio consectetur. Et iusto eos."", ""Nostrum sunt eum. Est iusto dolor sapiente rerum quisquam id corporis. Et ex corrupti quae perspiciatis error nulla amet."", ""Atque consequatur dignissimos. At expedita laboriosam doloribus voluptates eligendi. Aut numquam ad a necessitatibus quaerat quas.""]",airplane.jpg
Totam sit enim voluptas modi.,Polly Upton I,"[""Voluptates iusto ut dolorem et est velit nesciunt. Quis consequatur fugiat. Dignissimos voluptas quidem sapiente."", ""Quas animi consequatur et fugit. Quis ullam id eos atque deleniti. Nemo consequatur nisi."", ""Distinctio cum libero. Rerum sed dolore mollitia reprehenderit. Repellendus facere illo tempora. Sint non pariatur ea non."", ""Et dolorum dicta natus. Sunt porro voluptatem perferendis alias. Dolore reprehenderit eum illo nobis consequatur voluptatem. Qui voluptatem nobis vero deserunt. Quam amet eveniet eos ut vel adipisci.""]",beach.jpg
Ipsa quis dicta sunt.,Kim Schultz,"[""Libero eligendi et magni iure architecto asperiores amet. Dolorum labore fuga consequatur. Ea voluptatem natus ut sequi nihil quas. Suscipit est explicabo quidem hic necessitatibus laudantium quia. Quaerat et ipsa."", ""Quo omnis perspiciatis repellat rerum quia. Ex ut voluptatibus excepturi nulla. Omnis tempore aut cupiditate animi est tenetur. Eum aliquam et atque soluta et."", ""Voluptas ducimus modi qui et. Exercitationem et unde. Ea dignissimos cum alias perferendis amet eos occaecati."", ""Ducimus et libero placeat. Iste tempore commodi. Earum est id. Sit distinctio unde libero.""]",beach.jpg
Esse architecto voluptas sit.,Ms. Ima Gleichner,"[""Sit exercitationem laboriosam occaecati officiis dolores debitis. Dolore quia ipsam. Id ducimus ut dolorem maxime aliquid eum voluptas."", ""Dolorem deserunt hic accusamus repellendus aperiam. Consequatur ratione aliquid voluptatem autem aut beatae. Aspernatur accusantium reiciendis fugit molestias est placeat et. Omnis expedita blanditiis sunt enim itaque unde placeat."", ""Impedit aut ut ipsum cumque nihil tempore eveniet. Eum tenetur maxime dolores mollitia. Sapiente delectus consequatur quis earum ex harum voluptate. Et fugit nam."", ""Sequi itaque omnis ea dolor et est aperiam. Ipsam eos aspernatur et quo. Incidunt voluptatem quia eos aliquam qui. Iste quia neque quia sequi et aliquam. Ratione non quidem quis fugit ut est."", ""Est iure asperiores. Omnis tempore asperiores eaque quo totam. Ut voluptas voluptatibus. Delectus voluptatum occaecati. Doloribus occaecati facere repellat."", ""Libero adipisci suscipit consectetur expedita quia eum. Minus voluptate in fugiat optio minima omnis nostrum. Provident dolores quibusdam a voluptate aliquid. Explicabo voluptas nemo fugiat quaerat."", ""Nobis quia ad. Molestias nam nesciunt nostrum vel eos. Aliquid harum debitis dolore optio. Dolorem odit ut omnis hic. Blanditiis cumque dolorem voluptas."", ""Odit voluptatem et explicabo doloribus quia qui. Debitis architecto voluptatem autem et tenetur corrupti qui. Eius voluptatibus incidunt mollitia laboriosam voluptatem cumque voluptas."", ""Id et fuga quisquam sit rerum. Eos quo vitae nulla. Tempore quia et quis.""]",beach.jpg
Reiciendis voluptatibus corporis cupiditate et sit iusto nam.,Don Langosh,"[""Omnis natus quasi modi velit. Ut qui consequatur tenetur. Consequatur aliquam beatae dolorem autem nemo dolor. Laborum sunt necessitatibus recusandae quisquam consequatur provident sed. Et ducimus eveniet totam."", ""Tenetur qui delectus. Dolorem sint dolores. Sunt placeat at mollitia. Ab et amet commodi quo et."", ""Ad cupiditate nihil omnis laboriosam labore. Et cum et ut doloremque. Maxime doloremque ullam reprehenderit rerum aut."", ""Assumenda tempora est ab eligendi enim temporibus deleniti. Mollitia modi ipsa. Fuga sed fugiat ab accusamus ea. Cumque aliquam et. Mollitia sed sunt recusandae odio impedit deleniti minus."", ""Ea tempora quidem quo dolorem debitis. Nam iure debitis magni similique. Exercitationem aut sunt facilis suscipit aliquam consectetur labore. Ea harum quo. Ea sequi dolor dignissimos ut quia."", ""Consectetur dolor in aut itaque quis dolore aut. Veritatis iste cumque debitis autem in aliquid. Iure repellat natus consequatur similique modi assumenda voluptate. Aliquam quas ut at porro dicta."", ""Tempore ut et fuga sint ducimus minus repellat. Ea recusandae et labore rerum necessitatibus nemo eius. Voluptates atque aut nihil."", ""Nihil sunt consequatur modi. Beatae adipisci voluptates dolorem et dicta molestiae. Incidunt eos repellat."", ""Velit et recusandae sit qui in qui. Quo et quos et voluptatum pariatur aut veritatis. Laborum eos dolorem perspiciatis reprehenderit voluptas. Enim exercitationem et aperiam sunt minus.""]",airplane.jpg
Ipsa temporibus.,Heather Crooks,"[""Libero molestias omnis vel inventore deleniti qui doloribus. Quia veniam repellendus commodi dolor dolor quasi ut. Repellendus repellat harum ea."", ""Qui tempore veritatis sit consequatur sint quod delectus. Rerum quis aliquam id. Iste repellendus sunt doloribus sunt."", ""Fugiat omnis nesciunt. Reprehenderit iusto occaecati sint voluptatum natus. Officiis dolor quisquam aut facilis quod blanditiis omnis. Officia quis fugiat earum aliquid cum a. Labore quia repudiandae ut assumenda.""]",beach.jpg
Occaecati ipsa nihil rerum dolor.,Elouise Purdy PhD,"[""Dolor repellat saepe fuga praesentium. Fugiat recusandae quo soluta. Ut occaecati delectus."", ""Consequatur animi iusto cum placeat. Laboriosam corrupti magni perferendis dolorem rerum. Repudiandae enim ut aspernatur debitis non veniam. Hic eos nobis ut saepe doloribus. Veniam et optio et."", ""Aut minus vitae voluptas et maxime. Animi asperiores facere culpa et fuga qui. Odio dolor neque ut qui nostrum omnis. Fuga ducimus mollitia pariatur."", ""Nobis sed architecto maiores. Aut corrupti non. Odit tenetur deserunt minus.""]",airplane.jpg
Sed velit esse.,Ephraim Schroeder,"[""Laborum eveniet natus. Alias velit rerum occaecati sint. Accusantium perferendis voluptas est. Cumque earum recusandae officia eum dolor omnis."", ""Vel iusto cupiditate dolorem aut quas voluptatem. Qui quibusdam ea nesciunt sunt. Deserunt voluptas atque deleniti culpa dolores voluptas nesciunt. Sint sit aliquid veniam."", ""Delectus consequatur error ea itaque quidem praesentium. Nesciunt quia non nihil. Laborum nulla eum optio voluptas harum. Et omnis corporis nostrum quis optio ut iusto. Magni ut sed ut animi."", ""Laborum incidunt assumenda non. Error perferendis assumenda repellat fugit occaecati accusamus dolores. Earum minus quibusdam eos nemo. Hic unde aperiam nihil sed harum. Voluptas labore aliquid minus eum ut commodi amet."", ""Eveniet cumque illum voluptatem est ipsam quis. Modi tempore dignissimos ut quos suscipit facilis nobis. Beatae blanditiis soluta expedita voluptas quam. Fugiat qui earum ex. Omnis est qui totam."", ""Voluptatem nobis assumenda. Quia animi saepe in suscipit quam et rerum. Officia omnis temporibus."", ""Ex dignissimos ut ducimus animi aut. Aliquam nisi laboriosam aut ea illum nobis. Consequatur et et aut et voluptas est."", ""Aut excepturi facilis dolor repellat nobis laboriosam. Sint ea voluptatem ut enim eum sapiente quis. Nulla odit dolor sed amet. Consequatur quisquam error vitae quae. Cum ab odit blanditiis eius sint."", ""A illo aut quod minus ad quia quaerat. Beatae eaque repellat aperiam. Sunt qui esse dolorem quam. Et animi tempora et sit. Vitae distinctio exercitationem omnis fuga totam tempora blanditiis."", ""Voluptas voluptatum est consequatur nulla quasi laborum repudiandae. Officia quia quia odio vel culpa. Exercitationem maiores sit ea reprehenderit optio sit odit. Eum quam animi et.""]",beach.jpg
Quia totam culpa sit.,Micheal Simonis,"[""Aut doloremque id ea consectetur numquam. Fugit et non voluptas temporibus. Libero porro nemo voluptas. Aut dolor perferendis odio est nulla."", ""Omnis ut commodi cupiditate qui quam eum. Officia iusto odit ad architecto velit nostrum. Voluptas pariatur repellendus fugit accusantium."", ""Sunt provident et rerum. Beatae placeat corrupti blanditiis. Libero ea consequuntur."", ""Esse culpa blanditiis. Id aliquam omnis quo. Quia qui rem consequuntur distinctio dolorem."", ""Repellendus eos et deserunt quas rem. Velit consectetur nihil quisquam. Placeat aliquid ut molestiae odit harum. Doloremque assumenda nobis sit magni."", ""Et ut tempore quo iusto. Laudantium maiores provident. Ullam sint est et tenetur minima hic. Sed in voluptas placeat necessitatibus consequatur omnis."", ""Fugiat laboriosam et quibusdam. Earum recusandae reiciendis. Ut voluptatibus fuga voluptas quaerat doloremque magni.""]",airplane.jpg
Quas culpa natus repellendus.,Audra Roob IV,"[""Vero non molestiae iusto et expedita. Qui aut architecto. Ratione est alias perspiciatis et deserunt sed assumenda."", ""Quam et aut fugiat blanditiis amet non ipsam. Quis veritatis ipsa illo animi voluptatem excepturi. Asperiores vero consequatur laborum qui saepe nisi nesciunt. Aut assumenda reprehenderit."", ""Qui harum itaque. Eum repellendus vel. Illum voluptatum debitis rem ut minima deleniti sed."", ""Eum laudantium in omnis. Hic consequatur consequatur molestiae maiores illo et laudantium. Facere dolore quia recusandae quia officia."", ""Qui architecto unde et sunt sunt cum. Qui accusamus et quo ullam ratione. Voluptatem quam delectus doloremque modi."", ""Non ab sapiente sequi adipisci optio molestiae. Id quo pariatur. Voluptatum ut ab."", ""Accusamus odit facere consequatur ea. Atque consequatur sed voluptatem asperiores dolor. Praesentium est omnis. Eius adipisci debitis. Nobis quia culpa."", ""Aut vel quidem similique nisi officia. Magni consequatur expedita distinctio magnam natus perferendis. Occaecati illo sit. Eligendi architecto ipsa corrupti voluptas repellat modi fuga."", ""Incidunt odit porro architecto perspiciatis corporis aut iure. Autem est quia et ut vel. Assumenda repellendus perspiciatis quasi qui dolorum corporis eius.""]",airplane.jpg
Corrupti voluptas assumenda tempora eos.,Edmund Larson,"[""Omnis fugit aut at incidunt. Soluta rerum veniam omnis dolores laudantium in temporibus. Natus nisi voluptatibus numquam."", ""Alias culpa sit. Eligendi eum nisi molestiae. Ea et et autem dolor dolor sed. Tempora ex aliquid cumque neque vel officia. Aliquid ratione nihil adipisci velit."", ""Qui quia quis. Ea deserunt accusamus ut vel sed. Eveniet quibusdam ducimus sapiente quod sed. Impedit omnis officiis voluptatem hic temporibus."", ""Qui non autem rerum. Maiores voluptatibus repellendus in excepturi sit. Unde eligendi et sequi quam voluptatem nesciunt sed. Accusantium cum labore. Quisquam labore autem reiciendis quia."", ""Odio ipsum magnam ullam ab. Perspiciatis velit molestias rem sit vel. Quo aut dolorem fugiat eligendi labore odio. Quis voluptate voluptas quo aut omnis et. In itaque doloremque magnam."", ""Culpa qui possimus. Expedita quis et blanditiis sit quam commodi mollitia. Dicta aspernatur nam et necessitatibus vero incidunt ea."", ""Quae quod similique exercitationem accusamus enim. Minus non hic repellendus at mollitia consequatur. Eos qui molestias. Enim ut reiciendis fugiat."", ""Ut et est animi id. Iusto magni voluptatem. Amet nisi optio ipsam qui quia aut porro."", ""Qui non atque et. Non cum illum. Enim illo necessitatibus amet."", ""Veniam eos aut consequatur eligendi accusantium. Temporibus aliquam error officiis qui quos recusandae. Omnis unde voluptatem inventore ut. Neque autem est odio nulla corrupti consequuntur ipsa. Cum ex fugiat.""]",airplane.jpg
Deserunt explicabo dicta libero fugit.,Erling Turcotte,"[""Quas sed omnis aut qui qui itaque in. Quam inventore sint. Fugit aperiam rem. Cumque sed accusantium."", ""Quia culpa cumque nisi est. Reprehenderit nostrum ipsum quia eligendi quae qui nobis. Libero eaque ducimus."", ""Delectus at numquam et suscipit consequatur consequatur. Dicta sit quis voluptas alias. Distinctio quaerat numquam aspernatur sint eaque cum. Nihil et veniam qui magni velit sit."", ""Sed cum et et quam. Aliquam et qui expedita maxime aut. Veniam assumenda explicabo qui consequatur quas quod eligendi."", ""Vitae quibusdam sed aliquid rerum assumenda. Debitis distinctio ea et neque. Sed saepe minima eos nostrum in excepturi aut. Assumenda commodi molestiae quod libero sed voluptatem. Architecto quam illo voluptatum consequuntur voluptatem tempora asperiores."", ""Natus voluptate adipisci. Rerum voluptatum ut ab ipsum ea quos modi. Blanditiis maxime tempora sequi. Dolorem excepturi reiciendis molestiae. Omnis ut temporibus sunt."", ""In alias dolore omnis repellendus et. Distinctio fuga illo nisi rerum. Enim pariatur quo nihil iste."", ""Ut animi aut praesentium autem quo. Laudantium maxime et nobis quasi et. Modi cumque occaecati qui culpa ut quo dolores."", ""Consequatur incidunt perspiciatis. Voluptatem natus rerum nihil qui tenetur blanditiis aut. Dolorem consequatur tempore omnis dolore. Sed iste rem sit qui laborum assumenda. At eum quibusdam nulla assumenda veniam aperiam.""]",airplane.jpg
Dignissimos velit eos rerum molestiae distinctio accusantium.,Mr. Buster Stanton,"[""Suscipit perferendis aut omnis itaque reiciendis. Eligendi ipsam tempora. Culpa nam ea."", ""Aperiam aut recusandae et voluptates iure. Occaecati reiciendis eius. Accusantium rerum necessitatibus enim sequi quia cum iusto. Praesentium molestiae aut dicta commodi fuga tenetur soluta. Officia non dignissimos."", ""Delectus autem quidem quia aut. Assumenda minus tempora et eaque blanditiis neque laudantium. Iste quos quis commodi est consequatur.""]",beach.jpg
