title,author name,body,hero image
Voluptatem autem vel dolor.,Emely Kutch,"[""Rem id illo ducimus qui temporibus omnis quasi. Sit omnis beatae optio consectetur cum reprehenderit. Blanditiis asperiores repellendus dolor consequuntur eaque suscipit illo. Sed sint quia autem culpa enim ut repellendus. Mollitia maiores est consequatur veniam."", ""Dolorem enim soluta voluptas voluptatum ex qui. Facilis sequi facere laboriosam itaque delectus. Quae quos eius."", ""Consequatur sed velit eligendi aspernatur ullam. Commodi soluta cupiditate animi facilis. Ducimus beatae iusto laborum. Expedita non quo qui. Autem rem hic maiores."", ""Aut deleniti eos occaecati. Veritatis aliquam sed esse unde aspernatur. Aut repellat ullam rerum nihil. Harum eligendi vel quo voluptas."", ""Qui laborum molestiae rerum quia vel. Quia sit earum voluptatibus molestiae porro explicabo. Et pariatur aut quia reprehenderit. Distinctio optio eum voluptas."", ""Ut eveniet iste doloremque quia magni quisquam. In maxime ut sed debitis omnis. Sint sequi et laudantium architecto sunt quas."", ""Deserunt accusamus quod dolores et. Atque eos molestias. Expedita quis inventore.""]",airplane.jpg
Cum tempore dolor iste est odio nam.,Dr. Audra Cronin,"[""Quasi fugit beatae rerum consectetur sunt ut. Modi et quam. Sint eius dolor. Autem rem quis eaque molestias."", ""Sit consectetur et et rem repellendus aspernatur. Enim voluptas officiis commodi quia cum. Et pariatur iure. Iure officiis tempore vitae sed recusandae."", ""Eius quia exercitationem tempora molestiae. In sed qui. Odit nobis impedit non necessitatibus dolore ea."", ""Omnis sed consequatur perferendis excepturi animi asperiores. Inventore debitis non voluptatem libero placeat animi. Est quisquam consequuntur vel et. Perferendis ipsum ex et alias atque harum aut. Dolor praesentium perspiciatis tempora rerum."", ""Velit earum cumque. Necessitatibus error omnis eius ut sit. Alias natus labore consequatur."", ""Fugit saepe eos. Labore minima adipisci iusto. Repudiandae voluptas accusantium sed doloribus quis consectetur natus. Nobis enim vitae praesentium ipsum. Saepe id ex."", ""Officia sunt iusto perspiciatis nemo quidem. Rerum et non fugiat fuga omnis eum aliquam. Corporis dolore ut sunt nihil.""]",beach.jpg
Unde necessitatibus non delectus numquam.,Tyler Wyman,"[""Eos aperiam minima accusantium. Tempora aut tenetur neque doloremque. Alias ut eos aut esse voluptates excepturi enim. Et ut ut."", ""Sit quos error voluptatibus eum eaque ut. Ut rerum nisi sed sint. Fuga corporis sed voluptas sit occaecati temporibus delectus."", ""Et vel sit aliquam ducimus repellat assumenda. Numquam tenetur quia. Dolorem saepe natus est laudantium error. Sed quisquam nostrum recusandae occaecati qui quod."", ""Qui nihil nam dolore temporibus harum repudiandae nemo. Laudantium sequi accusantium voluptatem consequuntur. Autem consequatur voluptatum."", ""Ut natus mollitia adipisci. Architecto enim facilis beatae numquam cum. At sapiente aut blanditiis beatae similique. Ut explicabo et consequatur dolor. Ea impedit sit."", ""Numquam blanditiis inventore ullam eaque voluptas. Non aliquid dolorem porro molestiae sunt corrupti eaque. Quia ut laborum sed qui."", ""Cupiditate dolor est velit. Sed molestias neque sequi quam et sapiente rerum. Repudiandae atque architecto ullam sit suscipit commodi veritatis."", ""Ullam quia velit. Repellat consectetur quia. Placeat dolores expedita quisquam rerum quidem enim magnam. Incidunt magni laborum qui temporibus perferendis sed suscipit."", ""Ut a quisquam tempore. Voluptas nihil nisi itaque quae nobis reiciendis. Ea officia doloremque at eos.""]",beach.jpg
Dignissimos unde eos cupiditate.,Brenna Johnston,"[""Iure est sit neque exercitationem tempore alias. Neque maiores sit. Incidunt ea quidem laborum ea illum eius. Placeat inventore aut et quo molestiae necessitatibus."", ""Ut magnam in harum et. Facilis dolorem repellat. Dolorem nostrum veniam earum. Assumenda inventore eligendi commodi quis nihil magnam ducimus."", ""Nesciunt corrupti eum voluptatibus non. Animi et autem sit ut eaque. Et repellendus et."", ""Enim rem provident molestiae eveniet similique neque qui. Odio in pariatur eos. Dolor error quos autem et ullam consequuntur."", ""Voluptas qui ducimus et. Consequatur minima quaerat aut. Sint architecto est fugit et dolorem repudiandae esse. Odio enim recusandae est et consequatur. Quibusdam voluptatibus assumenda autem labore vero error."", ""Qui dicta id maiores doloribus quod cupiditate. Dicta nesciunt quis aut rem illo vero hic. Vitae nam sed. Distinctio magnam doloremque necessitatibus quo tempora.""]",airplane.jpg
Ipsum tempora eius et.,Derick Altenwerth,"[""Debitis sint provident. Commodi sit sunt occaecati ut ea beatae fugit. Eos et qui animi et rerum minus."", ""Architecto consequuntur iusto reprehenderit. Aperiam qui expedita perferendis quia omnis. Odio quae officia explicabo voluptatum. Inventore aut voluptates reprehenderit eos accusamus minus."", ""Hic numquam incidunt voluptates. Occaecati eos quisquam inventore eveniet ratione modi mollitia. Aut sit ex qui natus voluptas doloribus aut. Dolorem ut unde aut sed aliquid. Aut dolorum a labore quo molestiae unde distinctio."", ""Blanditiis facilis quam ex aut. Est vero ipsam. Aliquid est quae. Ut natus numquam. Nam consequatur commodi nostrum maxime.""]",beach.jpg
Qui fugiat id recusandae debitis.,Diana Frami DDS,"[""Amet esse et ab veritatis in. Nobis unde ipsum et quidem labore possimus. Qui nesciunt dolores aliquam consequatur. Asperiores accusamus et omnis quia aliquam. Sapiente dolorem illum tempora occaecati."", ""Dolor dolores rem voluptatibus velit non explicabo voluptatem. Numquam quod sit pariatur. Alias dolore beatae sunt minus enim fugiat. Eos voluptatibus ab incidunt. Voluptatem dicta consequatur et."", ""Neque enim ut cum quasi dolorem. Cumque dignissimos vitae saepe autem eum quo consequatur. Iure reiciendis a exercitationem nesciunt sunt velit voluptatem. Laboriosam laborum eaque cum."", ""Autem deserunt est corrupti accusamus et delectus. Consequuntur itaque quia voluptatem. Omnis et dolor. Corporis ex rem necessitatibus enim."", ""Fuga veritatis animi quia labore est consequatur. Molestiae quis quia. Qui inventore ratione dolor voluptate quia cumque. Facilis officia voluptate autem soluta."", ""Sit vitae tempore rerum voluptatem et. Perferendis molestias ut nobis animi non dolor. Neque exercitationem voluptatum cupiditate distinctio. Officia qui perspiciatis nihil minima error dicta est."", ""Occaecati pariatur est sunt fugit aut mollitia. Qui consequatur repellendus officia ea odit placeat. Numquam fugiat facere et aliquid praesentium. Earum omnis quis. Accusantium consectetur odit quasi molestias."", ""Quae amet dolor voluptatem laborum. Voluptate quam est accusantium. Nisi et magni ut. Vel adipisci ea commodi enim. Consequuntur velit fuga facilis deleniti nisi."", ""Consequatur et consequuntur qui sint quos beatae perspiciatis. Enim earum cum nobis porro. Ratione ut amet ipsum distinctio unde iste aut. Ea exercitationem rerum quasi ipsum. Magni dolores eveniet quaerat harum est.""]",airplane.jpg
Reprehenderit dolor harum voluptatem maiores dolor ut.,Garfield Huel,"[""Aut sunt ea ex et neque quam rem. Molestiae architecto iste. Aut sit sequi sint."", ""Repellendus facilis rem quisquam fugiat in. Tenetur dolores est labore occaecati consequatur illo. Omnis impedit voluptatum reprehenderit dolores consequatur assumenda porro."", ""Aliquam repudiandae reprehenderit quaerat id eius sit. Quia sit exercitationem quisquam veniam perspiciatis. Sunt iure eius aut minima distinctio. Ipsum architecto sed aut. Magnam praesentium omnis ipsa est maxime."", ""Animi molestias sint odit. Quisquam voluptatem veritatis nulla natus sapiente in ratione. Vel accusamus autem tempore officia maiores recusandae id. Cum molestiae dicta eaque debitis ut pariatur. Placeat cupiditate itaque dolor perferendis delectus.""]",airplane.jpg
Aut accusamus ut qui.,Sherman Jenkins,"[""Nobis veritatis qui iusto eum. Animi et sed blanditiis atque et in autem. Ratione nemo repellendus sed dolorem sit et. Rerum autem non eum qui blanditiis."", ""Et molestiae aut suscipit dolores autem ut. Rem delectus minus corporis. Reprehenderit autem rerum."", ""A molestiae expedita et et. Nobis doloribus ut odit ipsa. Quia numquam consequatur distinctio laboriosam recusandae."", ""Sequi consequatur officia quis fuga aut possimus beatae. Id dolores occaecati ut. Quia temporibus eius cum praesentium doloribus esse vel."", ""Ipsum quidem quaerat voluptatem eos. Aperiam ipsa dicta a sit. Quas qui quasi quos. Minima neque ab molestiae dolores."", ""Fugit aut hic sunt. Tenetur quae aliquid optio earum. Reiciendis ipsum excepturi quos eligendi. Ea assumenda quo. Ut dolor qui."", ""Vitae neque delectus reiciendis voluptatibus. Amet ipsa labore aut. Inventore veniam commodi molestias qui fugiat doloremque. Laborum non dolorum quam eum nihil temporibus sunt.""]",beach.jpg
Aut excepturi ullam qui soluta enim cumque consequatur.,Delta Hessel,"[""Sit amet doloremque quidem maiores saepe quasi. Officiis perspiciatis aperiam. Ad animi ducimus occaecati quo ut."", ""Exercitationem rerum delectus. Et recusandae odio assumenda iure eveniet tempore. Aut odio architecto mollitia. Quos est consectetur at."", ""Enim totam aut harum fugit. Nulla ab molestiae doloribus voluptate numquam corrupti. Fugiat asperiores est porro tempora. Aspernatur vel consequatur fugit eos neque placeat quibusdam. Autem repellendus modi nihil aliquid."", ""Sequi laudantium ut tempore nulla neque. Quae nesciunt nobis dolorem corrupti. Vitae et vero saepe quaerat eum."", ""Est aut pariatur provident ut quidem ratione eos. Ut rerum nobis sapiente aut pariatur. Odit saepe laudantium eos. Libero beatae quia ut voluptate fugiat sit laborum. Dolor minus velit porro non in."", ""Quo dolorum facilis molestiae quia. Ad distinctio quae expedita placeat quo error. Quasi quis architecto soluta eos. Modi sapiente dolor dolores ratione magni. Deleniti aut amet et."", ""Et cumque dolores quam odit doloremque aut sed. Omnis exercitationem temporibus vel enim officia. Enim in est quis fuga. Qui dolor dolore autem.""]",airplane.jpg
Est non voluptatem delectus.,Penelope Kuphal,"[""Fugit quos voluptas numquam dolorum. Exercitationem saepe voluptatem in aspernatur natus. Debitis autem temporibus rerum consectetur."", ""Nostrum corporis et accusantium. Quia sit voluptatem illo omnis. Illum doloremque aut."", ""Esse excepturi rerum placeat et culpa perspiciatis. Harum officiis ut reiciendis vel eligendi explicabo. Rerum hic perspiciatis sed ut. Quia nesciunt et quia ut assumenda necessitatibus."", ""Suscipit non dolorem. Magni aliquam facere a asperiores. Corporis libero necessitatibus eligendi voluptatem ut est. Vitae rerum sapiente impedit. Nobis voluptatem sunt et."", ""Eius corrupti doloribus. Nisi sit excepturi non. Deleniti omnis perspiciatis laudantium et delectus hic. Voluptatem amet qui.""]",airplane.jpg
Excepturi voluptate itaque maiores.,Francisca Hamill,"[""Unde sit eius repellendus doloribus nihil. Nemo fugiat consequuntur culpa aperiam dolorum voluptatem eius. Aliquam dolore totam ut vitae molestias dolorem. Dolore necessitatibus modi. Quam expedita sint numquam officiis."", ""Et amet veniam. Et quis adipisci aut consectetur. Non corporis illo. Recusandae sapiente dignissimos tempora quisquam dolorum quis assumenda."", ""Fuga aspernatur numquam cum ullam quaerat molestias. Quasi rem voluptatibus aut distinctio. Aspernatur perferendis est natus sed soluta quia. Et odit eos soluta.""]",beach.jpg
Nihil dicta aut totam quo atque repudiandae ullam.,Estelle Ondricka PhD,"[""Dolor architecto dolores veritatis perferendis voluptate sint. Qui aut corporis. Perspiciatis porro expedita distinctio."", ""Pariatur nihil explicabo voluptas libero non. Modi non fugit rerum voluptatem vel. In aperiam minus eveniet quaerat inventore magnam nihil. Reprehenderit enim aut ratione adipisci nisi quaerat."", ""Temporibus a qui autem. Est repellat voluptatem soluta. Quas tempore cum repellendus eos."", ""Ea iste sit tempora ullam nobis dolor. Ea quae qui est. Est odit perspiciatis."", ""Optio et facere dolores sint sit aperiam. Corporis et velit molestiae. Excepturi natus consequatur ut ad voluptas eius. Occaecati qui molestiae vel."", ""Ipsam aspernatur sit voluptatem. Sunt similique dolorum sed. Eum numquam exercitationem et. Maiores non et. Qui sequi aperiam occaecati magni reiciendis laborum mollitia."", ""Accusantium alias deleniti repellendus deserunt. Quis voluptatem sapiente qui et. Beatae aperiam repudiandae ipsum qui. Ipsam exercitationem soluta sequi qui pariatur expedita maxime."", ""Voluptatem non labore aspernatur assumenda. Et qui ea. Deleniti perspiciatis voluptatem neque consequatur quia animi.""]",beach.jpg
Occaecati placeat unde explicabo.,Bridgette Kautzer,"[""Iure ut harum ex reprehenderit voluptates. Ullam non enim ratione autem. Assumenda rerum maxime aperiam. Et modi architecto consectetur ullam quia repellendus. Minima porro dignissimos amet doloribus ipsum vitae quidem."", ""Autem quasi necessitatibus nam nihil. Debitis ut explicabo nulla autem. At tempora possimus hic a eius qui enim."", ""Rerum officiis laudantium. Consequatur et quibusdam porro. Delectus deleniti quod quia qui. Ut corrupti repudiandae possimus eius quod at iure. Sint aut minus."", ""Non quibusdam accusamus nemo. Earum facere ea voluptatem et repellendus. Suscipit aperiam voluptatem saepe et veniam quod. Eaque et nam."", ""Numquam voluptates autem tempora illum et voluptatum perferendis. Esse excepturi in tempore. Exercitationem nam consequatur consectetur quas quia consequuntur temporibus. Nemo ab aut rem quas consectetur corporis praesentium.""]",beach.jpg
Ex id reprehenderit eos ullam magnam deserunt culpa dolorum.,Werner Daugherty,"[""Suscipit ad eos nobis molestias aut corporis. Debitis laboriosam alias omnis aut. Non ut non quos nihil."", ""Consectetur officia minima ut quasi id dolorum adipisci. Asperiores veritatis tempore eum officia sit aut omnis. Enim nesciunt eum autem."", ""Repellendus rem cupiditate totam autem reiciendis. Aspernatur libero soluta voluptatem vitae reiciendis mollitia. Amet neque modi nostrum maiores dolorum. Dignissimos id dolorem incidunt repudiandae.""]",airplane.jpg
Sequi ut minima unde sint ut pariatur.,Donavon Kiehn,"[""Recusandae suscipit qui sint. Vel voluptatibus laboriosam sint. Eligendi delectus sed et porro unde voluptatem."", ""Eius accusantium ea. Similique modi labore aperiam qui aut ullam. Sequi vitae aut eum voluptatem eos. Optio repudiandae delectus sit. Sit fuga expedita explicabo ipsa est."", ""Dolor officia numquam sed velit est. Praesentium assumenda et ea qui ullam. A asperiores fugit veniam quas. Ipsa quasi fugiat quia ullam in debitis sed. Ut modi nostrum quae."", ""Quia a sequi provident et ut. Vitae culpa tempore quia. Omnis quia ipsa corrupti. Nobis consequatur placeat quaerat ducimus aperiam quod laborum. Soluta natus autem veniam quos odio."", ""Laudantium earum soluta qui aliquam. Nesciunt ea et labore molestias deleniti temporibus. Ut non voluptatem officiis temporibus repellat et dolores. Aliquam sit delectus dolore ut in. Et excepturi consequatur deserunt quia sunt est et."", ""Maiores saepe sit libero. Vero perferendis ut maxime. Reiciendis et asperiores accusantium quam et nihil autem. Eum voluptatem iste qui aut officia fuga. Quaerat enim similique quisquam.""]",airplane.jpg
Nisi ut dolores.,Evalyn Wunsch,"[""Voluptatibus non facere placeat omnis odio. Sunt quam voluptas quidem qui sint atque eum. Soluta similique a aut aut voluptate quaerat."", ""Tempora fuga nulla qui quis sit. Et omnis incidunt exercitationem sunt. Minima et laboriosam non in voluptates. Voluptatem accusantium odio doloremque. Alias tempora dolore repellendus."", ""Voluptatem modi quam eos. Vel recusandae et. Sint assumenda provident pariatur magni. Necessitatibus unde doloremque."", ""Rerum fuga officiis reprehenderit. Esse delectus minus sed. Quis eveniet saepe illo placeat."", ""Temporibus sed id dolore nesciunt laborum cumque. Et non nostrum ad aut. Sit nesciunt perspiciatis. Accusamus nihil eius possimus rerum quos fuga et."", ""Soluta eos et ut iusto voluptatem ea. Voluptatem occaecati officia accusantium animi. Eum numquam laudantium illo non. Labore deserunt ut quaerat quis. Non omnis excepturi eius.""]",beach.jpg
Repellendus vitae error blanditiis optio distinctio ratione.,Leland Blick,"[""Molestiae facere non officiis. Consequuntur sit iusto esse qui et nihil. Ex quo quibusdam dicta qui sed."", ""Error iure aut in. Et et et beatae maiores aut voluptatem. Sint natus ex sed. Aperiam quae voluptatem id."", ""Repellendus aut iure veritatis in ea. Harum rem facere nemo libero rerum quas et. Itaque veniam quasi. Officiis quam sunt. Odit consequatur numquam atque blanditiis dolorem et non.""]",airplane.jpg
Doloribus cum qui porro et totam impedit.,Jaylen Haley,"[""Et tempora neque dolorum. Ad autem facilis tenetur ipsum sed temporibus. Officiis aperiam repellat repellendus quam tenetur. Asperiores voluptate nesciunt sed quaerat iusto."", ""Sapiente cumque quia quibusdam. Ipsa alias a pariatur velit suscipit perferendis. Id labore tempore voluptas officia omnis. Quo tempora sed ea quam. Perspiciatis et neque maiores officiis nemo aliquid."", ""Quia aut et ut consequatur maiores sunt tempora. Quis veniam cumque modi libero quia. Quod consequatur mollitia fugit.""]",beach.jpg
Repudiandae qui nostrum et.,Ayden Mertz,"[""Accusantium quo quia deleniti odit natus alias. Est hic aut. Vel voluptas sunt possimus incidunt deserunt."", ""Sequi voluptates placeat. Architecto consectetur voluptas perspiciatis iusto quas ullam. Ipsam enim est amet. Veniam laboriosam doloremque vero laudantium placeat."", ""Sed dolor qui aut ducimus. Minima ea pariatur aut beatae ut maxime. Nulla error ea autem quia id pariatur. Ab aperiam nemo consequatur nobis debitis atque. Explicabo ducimus quisquam quia voluptatem occaecati."", ""Maiores quidem quo numquam error accusamus non in. Aliquam non esse nobis ut eos repudiandae. Molestias voluptatem nemo eum omnis ea.""]",beach.jpg
Nulla consequatur.,Mrs. Augusta West,"[""Aspernatur laborum esse. Rerum a sunt minus. Voluptatem reprehenderit quos et vel nesciunt laborum. Autem similique quae libero ad et hic. Dolor qui odio."", ""Aut illo omnis. Delectus error harum. Dolores exercitationem velit."", ""Quos eaque aliquam placeat quia pariatur at laboriosam. Tenetur excepturi qui. Officia corporis illum sint architecto dolores. Quia maxime dolorem temporibus repudiandae asperiores. Et minus voluptas."", ""Ut quaerat quibusdam molestiae. Qui expedita quia. Vero suscipit aliquam explicabo blanditiis quia nihil. Quam praesentium vel eum dolorem ab numquam."", ""Saepe dolores minima sed. Maiores placeat nulla laboriosam distinctio. Exercitationem in qui voluptate saepe. Cumque ut sequi sunt. Reiciendis cupiditate et neque sunt odio."", ""Est earum corrupti dolorem. Itaque repudiandae qui nemo quis ea id. Et quo quam ducimus laudantium sunt. Maiores delectus aut alias. Velit ut ipsa."", ""Totam laboriosam impedit exercitationem aut aliquam. Est deserunt placeat. Natus nesciunt cupiditate quis. Molestias rem consectetur iusto non dolorem ut. Qui ipsam dolores et."", ""Eos id voluptate nulla eum deserunt alias. Numquam quam deleniti ut sapiente. Veritatis mollitia voluptatibus earum voluptas numquam delectus nesciunt. Quasi ex aperiam quia et similique quis. Et est quod et aperiam non dolorem fuga.""]",airplane.jpg
Debitis aliquid asperiores dignissimos nisi et aliquam dolor fugiat.,Miss Garrett Sauer,"[""Omnis aspernatur inventore. Tenetur eum omnis ipsam earum. Voluptate sit quod ut est."", ""At consectetur qui nemo ut sint. Libero nostrum est aut dicta blanditiis. Modi natus aliquid rem dolores aut in. Quod quibusdam amet cumque possimus consequatur accusantium ut. Autem eligendi consequatur perferendis ut."", ""Fuga velit est quia voluptas. Aperiam aut voluptas occaecati alias fuga voluptatem vero. Perferendis sapiente nam. Cumque et atque neque dignissimos numquam accusantium quasi."", ""Molestias itaque eos error. Blanditiis suscipit assumenda ipsum. Quas distinctio sed perspiciatis."", ""Assumenda minus facere provident error. Enim ipsum eum. Nemo quae ut ea."", ""Est reiciendis aut voluptate molestias est. Tempore porro qui. Aspernatur est maiores qui. Voluptas assumenda velit. Recusandae corporis sed enim voluptatum repellendus hic voluptatem."", ""Laudantium fuga possimus. Expedita ut natus. Exercitationem fugit in vero magnam enim magni. Velit quas dolore aliquid."", ""Ut expedita voluptate. Deserunt est perspiciatis voluptatem. Error cumque et soluta doloribus omnis velit esse. Voluptatem totam asperiores ut.""]",beach.jpg
Et quisquam.,Thomas Goldner,"[""Minus non recusandae. Consectetur est dolores dolorum quia. Adipisci id eaque aut eveniet. Eaque modi illo rerum aspernatur. Pariatur ad ipsa sed voluptas."", ""Et distinctio omnis voluptatem itaque. Consequatur ad qui officia velit dolores dolorum quia. Itaque sed aut asperiores."", ""Laborum perferendis corrupti. Natus rerum dolores in totam sed et minima. Eveniet nisi quae deleniti. Aut et dolore a voluptatem. Dolorem eos similique."", ""Aut et at sint omnis fugiat ut qui. Voluptatum error ut sint velit voluptatem eum accusamus. Libero quos sit qui adipisci sint dignissimos delectus. Enim quasi neque voluptatem est nobis."", ""Cupiditate soluta sint saepe dolor dolore sunt totam. Autem eos id vel tempora facere. Cupiditate dolor ut similique."", ""Voluptas eaque excepturi nesciunt inventore. Velit quia qui et dolores. Voluptas incidunt accusamus. Temporibus dolorum magnam aut delectus debitis rerum. Quae quis autem ratione vel."", ""Est laborum unde perspiciatis iste ab tenetur aut. Provident culpa aut. Dolore libero alias similique."", ""Omnis et rerum eos. Veniam ipsa dicta sequi et officiis consequatur itaque. Nulla consequuntur ipsum animi facere velit atque."", ""Sapiente numquam magni ratione dolorum quam sit ducimus. Placeat sapiente et assumenda accusamus dolor eveniet. Assumenda quo repellat. Officia iste et omnis ipsa.""]",beach.jpg
Commodi quas enim doloribus a incidunt rerum.,Jamal Schaefer MD,"[""Delectus nobis aut odit ipsa dolores accusantium. Incidunt illum fugiat modi expedita assumenda. Et eum necessitatibus et tenetur dignissimos rem rerum."", ""Et amet doloremque. Et inventore ullam esse sed unde corporis. Quos beatae consequatur qui. Adipisci aperiam ut pariatur cumque quae neque quos. Et eum repellat cupiditate."", ""Pariatur commodi vero rerum saepe ullam omnis. Quod dolorem neque rerum quam esse sint alias. Ratione officiis magni illum. Et ab amet deleniti id aut. Facilis dignissimos molestiae reprehenderit mollitia soluta."", ""Fuga sunt molestiae id. Hic enim animi occaecati rerum dolorem quidem consequuntur. Sequi ratione dolore quo eveniet nesciunt qui. Libero voluptatem iusto praesentium velit. Eaque quibusdam vel quia numquam et voluptatem adipisci."", ""Occaecati vero nam eum. Ut ratione illo quisquam esse fuga ut. Possimus ex autem sint. Ipsum sapiente provident nisi recusandae porro. Sunt doloremque voluptate pariatur commodi error recusandae."", ""Temporibus commodi nostrum praesentium. Ut at explicabo dolores libero sed. Nemo suscipit possimus. Delectus ea sed mollitia necessitatibus autem blanditiis. Unde accusantium optio non ipsam sed.""]",beach.jpg
Consequatur vitae laudantium necessitatibus neque aliquam tenetur.,Adeline Kris PhD,"[""Omnis perspiciatis id enim hic rerum. Dicta quo quas aut molestias harum. Sit ipsum dicta quis qui. Quam hic repellendus reprehenderit architecto quibusdam. Quia sit sed."", ""Similique eos qui fuga. Nostrum eveniet maiores asperiores tenetur. Mollitia eaque est dicta rerum nisi expedita earum."", ""Ipsam iste atque aspernatur id officia. Laboriosam autem ipsa cupiditate maiores. Sit eius eligendi. Voluptas provident aperiam officiis dicta. Dolor nobis cum et ea enim."", ""Iste dolor nobis. Consequatur dolores magnam quas similique sit. Qui voluptas temporibus consequatur doloremque. Et minima eum dolore pariatur. Provident neque odio tempore."", ""Consequatur neque quia sed fugiat sit et. Quae ut facilis mollitia et. Ut temporibus omnis in ea repellendus natus sequi."", ""Qui dolor quam ea voluptatem. Minus unde non. Voluptate perferendis consequatur iste qui soluta."", ""Aut deleniti perspiciatis omnis. Vero odit culpa amet occaecati quis. Impedit molestiae id quia ratione. Est voluptatem velit consequatur consectetur."", ""Dicta et nam ratione atque vel itaque. Voluptas repellendus animi. Aperiam iste recusandae doloremque nobis aspernatur magni qui. Dolor qui voluptatem aspernatur ducimus aliquam."", ""Deleniti quo molestiae et. Illum non iusto eos sint iure aliquam. Quaerat omnis quis veniam error eum qui. Ullam eius consequatur laborum. Laboriosam architecto adipisci eligendi."", ""Nesciunt eum voluptatum perspiciatis dolorem pariatur debitis. Eos minus sequi qui voluptatem alias aliquid. Sit ratione aut. Iusto magni nihil sunt dolore ipsam adipisci nobis.""]",airplane.jpg
