title,author name,body,hero image
Accusamus laudantium ipsa repellendus cum non rem.,Roderick Medhurst DDS,"[""Explicabo atque voluptas. Modi corrupti cupiditate exercitationem sit minima ea. Earum quaerat aut cumque voluptates qui ut."", ""Cum qui ea repellendus rerum reprehenderit a. Sint ullam nostrum delectus ipsum illum doloremque. Cumque nihil exercitationem et ut voluptatem ratione sapiente. Recusandae non quas tenetur asperiores qui odit vitae. Sed id vel et."", ""Vel eum quia eum soluta rerum tempora. Exercitationem ratione sit nihil. Mollitia similique odit.""]",beach.jpg
Est libero unde in et.,Sylvester Donnelly,"[""Quia quo sint quidem atque. Consequuntur velit sunt ut. Maiores reprehenderit pariatur cumque voluptates distinctio doloremque. Error qui fugiat quia."", ""Voluptate consequuntur ratione. Dolorem quo earum corporis ut. Deleniti ad sint at dolorem. Voluptatem hic qui sed quos enim enim. Accusantium nemo numquam voluptatibus consectetur."", ""Delectus ea odio aut qui non et occaecati. Est doloremque reiciendis voluptatem et et minus. Perspiciatis incidunt aut magnam."", ""Accusamus nulla qui ducimus quod molestias. Laboriosam et perferendis sequi expedita aliquam impedit maxime. Voluptatibus eos quia illo quo qui nostrum eum. Sunt et enim quidem voluptatibus esse doloribus nemo. Voluptas quod quisquam velit et architecto.""]",beach.jpg
Eos ut pariatur harum vitae atque quidem.,Miss Jaron MacGyver,"[""Dolorem consequatur tempore quasi id ducimus nihil eos. Rerum et molestias totam. Laudantium et molestiae natus facilis. Error voluptatibus aperiam qui quos debitis et."", ""Necessitatibus enim laudantium blanditiis excepturi et animi. Blanditiis dolor nemo est. Recusandae aut et ducimus eius ea autem. Nemo impedit quo."", ""Et ullam beatae nemo. Molestiae ea aspernatur ab molestias atque minima. Nostrum maxime eos ipsam dolor."", ""Ea numquam qui qui reprehenderit ea non est. Qui doloremque et sed quos. Repellendus aspernatur ratione. Ut nihil repellat.""]",beach.jpg
Ratione corporis error veniam nihil neque minima ipsa.,Miss Natasha Corwin,"[""Tempora sit consequuntur ad nulla et a facere. Ut praesentium officia. Quis autem atque adipisci non possimus. Voluptatem aspernatur eum."", ""Vel rem accusamus et fugit. Saepe a eos modi ipsum aliquid consequatur. Est autem suscipit optio et ipsam cumque earum."", ""Et optio unde inventore amet eum et. Molestias ut quisquam ratione rerum eum voluptatem. Enim doloremque soluta et magnam animi. Totam maiores quos voluptatem provident voluptas."", ""Perferendis aut ut aut delectus aut. Ducimus pariatur non excepturi. Quos omnis tenetur reiciendis mollitia. Laudantium expedita qui et.""]",beach.jpg
Quae quos.,Katelyn Herman Sr.,"[""Id quaerat soluta. Voluptatem at non aut. Asperiores accusamus eveniet. Distinctio natus ipsa in tempora optio at perferendis. Aperiam eum inventore quo provident in facere corporis."", ""Tempora voluptas ab voluptas libero aut. Voluptatem quia quidem. Illo qui iure aliquam tempore voluptatem recusandae aut. Ipsa voluptatem iure aliquam sunt est."", ""Odit error animi neque. Cupiditate odio nemo et rem nisi. Repudiandae animi minus dolorem occaecati illo dolorem deserunt. Velit quia quo eum provident. Ipsum non eius quia voluptas impedit minus veritatis."", ""Corrupti non qui excepturi doloribus. Dolor tempore exercitationem quae consequuntur omnis ut. Quo adipisci sit quasi cum."", ""Voluptatem quaerat dolores id facilis. Quisquam explicabo minus error dicta harum natus. Ut rerum molestiae nisi eum quo. Sit dolores beatae minus odit. Quibusdam sunt placeat consequatur quasi corporis."", ""Consequatur atque numquam tempore ab in in. Nisi aut ad ut tempora provident. Qui officia provident enim nisi amet. Facere quaerat aliquid dolorum nostrum numquam similique quae. Quis facilis iure culpa perspiciatis laboriosam fugiat."", ""Qui laudantium iste eum. Soluta vel doloremque. Consectetur laborum necessitatibus mollitia est.""]",beach.jpg
Accusamus totam iure quo laboriosam.,Yasmin Windler,"[""Ea cupiditate blanditiis in qui et nulla. Sunt magni nam. Maiores eligendi est est ullam rem recusandae. Quaerat qui nobis officiis sunt tenetur est culpa. Et occaecati impedit atque rerum ducimus vero."", ""Sit ipsa sunt optio laudantium. Quo qui cupiditate error. Similique consequatur quae rerum architecto. Est nulla ratione molestiae dolore aut laudantium. Rerum qui consequatur autem aut id repellendus."", ""Quidem totam illum id culpa fugit. Omnis eum et. Minus quis non totam ut architecto. Molestias quidem sed ut nemo."", ""Magni suscipit iure dolores excepturi sunt vel velit. Nesciunt temporibus deserunt corporis. Quos optio hic velit. Voluptas id fugit et asperiores quaerat."", ""Incidunt quos nulla eos. Rem eligendi magni natus quia ut ut provident. Cum totam enim. Harum debitis eligendi qui ipsum non quia.""]",airplane.jpg
Et alias id consequatur quia pariatur omnis quis.,George Gulgowski,"[""Consequatur occaecati id molestiae distinctio nisi sed. Provident unde et at non. Sapiente soluta eum perferendis tempora. Sed temporibus ut in eveniet ipsum quia rem. Ut quas cum praesentium accusantium."", ""Sit consectetur occaecati. Recusandae minus consequatur quia animi molestiae cum magnam. Aut accusamus veritatis voluptatem assumenda et. Nulla enim et non."", ""Vitae occaecati dicta perferendis voluptatem minima voluptas. Ea ullam qui et et magnam qui. Dolorum veniam ipsum voluptatem earum velit."", ""Et sit consectetur. Quo unde doloremque eligendi cupiditate. Ipsa facere sed sed incidunt. Atque temporibus autem.""]",airplane.jpg
Harum a est et voluptate rem ea.,Mr. Marvin Mitchell,"[""Architecto quam ut error earum quia. Incidunt ad ab iste tempora doloremque. Et corrupti neque ipsam sit. Voluptatem sequi corrupti quia. Est iure laboriosam doloribus in aut."", ""Debitis accusantium labore inventore aut rerum sit. Voluptas et consequatur. Aspernatur reprehenderit ipsum nemo illo distinctio. Ea enim iure. Deserunt quis vitae nobis animi sint sunt."", ""Ut saepe debitis laboriosam aut voluptatem sequi. Itaque doloribus est dolor. In optio distinctio facere blanditiis sed non."", ""Aut quod quo necessitatibus explicabo ducimus. Est nostrum odio quo incidunt. Quis corrupti reiciendis."", ""Aperiam doloremque fuga in blanditiis. Voluptas inventore molestiae. Ducimus animi suscipit doloremque voluptate. Aperiam occaecati ut hic et. Corporis iusto unde eaque.""]",beach.jpg
Est laboriosam.,Macey Tillman,"[""Magni sed quidem. Aperiam perferendis animi deleniti aut laboriosam et soluta. Beatae explicabo accusantium minima similique voluptatem. Neque qui maxime cumque voluptate ad amet."", ""Quia atque molestiae numquam deleniti iusto commodi. Beatae et exercitationem corrupti. Earum aperiam error sapiente incidunt et sit nulla. Alias ipsum ex sed dolorem. Perspiciatis et dolorem iste nisi in dolores."", ""Dolorum ut ipsam ex quia ad magnam necessitatibus. Repudiandae ad eaque. Dignissimos sit quia et. Iusto ea voluptas eaque quis."", ""Id eaque libero cupiditate animi. Qui vel laborum. Quisquam voluptate nostrum est sed. Eos ducimus numquam tenetur sequi quia omnis est."", ""Repudiandae quia molestiae voluptates. Optio pariatur veritatis ut unde ea porro. Praesentium consequatur modi possimus molestiae illo doloremque.""]",airplane.jpg
Sed ducimus non voluptates consequatur optio.,Dr. Harmon Stiedemann,"[""Earum impedit ipsam debitis provident voluptatem. Odit dolorem cupiditate qui. Numquam sit voluptatum aut fuga omnis voluptas. Dolor aperiam ut dicta."", ""Voluptatem numquam aut provident accusamus. At qui facilis inventore exercitationem. Quos sit odio dolore autem quo. Molestiae molestiae sit tempore doloribus. Sed ducimus id aut sapiente vitae quibusdam corrupti."", ""Ullam mollitia voluptatem. Et placeat non consequatur deleniti ad quidem. Sed rerum cum repudiandae qui aut nulla dolores."", ""Eaque laboriosam quia vel fugit. Consectetur provident totam et reiciendis tempora. Nisi amet placeat. Ullam odit autem eius id dolores hic veniam."", ""Dolores consectetur illo quis. Inventore ut voluptas optio molestiae voluptas repellat numquam. Similique occaecati officia."", ""Odit est perspiciatis. Omnis est iure natus ea possimus reiciendis. Earum nostrum et suscipit sed id."", ""Laudantium qui nesciunt. Aut minima omnis placeat. Quae at dolorum ut labore earum fugit. Pariatur tempore ipsa et veniam. Repellat est blanditiis rerum."", ""Sit debitis vitae voluptates perspiciatis ex dolorem. Corrupti nemo nihil officiis consequuntur totam dicta. Sequi quasi voluptas itaque modi incidunt non odio.""]",beach.jpg
Id ut.,Chadrick Bradtke,"[""Provident quaerat odit voluptatem dolorem dolorem quod aliquid. Rerum nesciunt at excepturi. Qui dolore dolores. Perferendis quo tempore culpa. Sed alias sit nesciunt est voluptas."", ""Repellendus totam porro laborum et. Et amet aut tempore. Non esse voluptas odit ea repellendus."", ""Rerum dolorum distinctio. Fugit animi et enim pariatur eaque. Molestiae iste fugit neque. Inventore magnam ex eum illum sit sed placeat. Quia architecto adipisci modi."", ""Sunt quos tempora quas. Qui at quasi labore. Modi delectus commodi."", ""Voluptas deserunt enim molestiae. Nisi omnis fugiat enim aut ut nulla. Neque necessitatibus totam eligendi."", ""Cum fugit dolor et aperiam. Eligendi inventore quia velit. Maiores autem natus beatae ut tempore similique aperiam. Omnis recusandae quia voluptates qui."", ""Reprehenderit illum natus debitis eos totam temporibus. Et minus iusto aut. Quia sint nostrum unde illo odit eius quibusdam.""]",airplane.jpg
Debitis non nihil corporis.,Moses Lehner Jr.,"[""Provident dolore repellendus et voluptatem quia. Vitae voluptates non atque. Minus nihil in libero deserunt dolore nostrum harum. Sunt ex possimus illo totam qui eos autem. Quod libero et alias voluptatem voluptate itaque qui."", ""Voluptatibus in vitae sapiente vero. Ex omnis velit. Asperiores consequatur sunt aut facilis aliquam quasi. Qui laborum excepturi libero eius."", ""Nostrum aspernatur omnis inventore. Doloremque maiores perferendis et ipsum sequi consequuntur tempore. Facilis molestiae rerum sint est."", ""Est et ducimus explicabo cupiditate dolores. Neque omnis doloremque iure ipsam consectetur harum soluta. At iusto veritatis earum. Adipisci accusantium aspernatur quibusdam.""]",airplane.jpg
Et iusto quia ut culpa aut.,Zella Windler,"[""Ut ratione qui vel rem est inventore quasi. Sint similique eaque. Sint nisi ad ducimus eos est mollitia possimus. Facilis illum ut dolores eos eum et. Nihil impedit ab placeat aut ullam voluptatum repellendus."", ""Tempora aut ut modi soluta quos illum nisi. Iusto commodi aut. Impedit nihil aperiam esse."", ""Dolorem quod omnis quis sequi. Illum et nihil. Soluta placeat optio incidunt facere."", ""Ipsam voluptatem officia quibusdam expedita distinctio. Saepe quae architecto repellat officiis deserunt molestias aut. Quis sequi expedita ab. Quis quam debitis. Et deserunt quis."", ""Quidem accusantium enim eos est alias eum dignissimos. Non velit expedita dicta rerum minus quis. Nobis laboriosam laborum voluptates sequi sed. Eius dicta numquam dolor."", ""Iste vero cumque necessitatibus. Sed consequatur vel eaque rem iusto. Voluptas voluptate veritatis. Tempora sint ducimus et veritatis rem quo."", ""Ullam qui tempora. Ea deleniti perspiciatis repellat ea sed. Possimus sapiente atque aut voluptatem recusandae."", ""Quisquam reiciendis est in natus fugiat. Ut atque doloribus consequuntur amet exercitationem ipsa alias. Reprehenderit sed enim consequatur quasi dolorum quaerat fuga. Hic est quas. Sint impedit consectetur eos."", ""Dolores suscipit alias a eaque. Quis mollitia quae sed error earum placeat. Dolor beatae quia voluptatum suscipit officiis eaque. Est dignissimos harum in rem voluptatem illum."", ""Quibusdam numquam accusamus reiciendis quia voluptate quo. Maxime ab labore. In rerum iure et et facilis ullam autem. Voluptatem libero et et quis ut aliquam.""]",beach.jpg
Quaerat aut magnam nobis quas quia iure porro iusto.,Mr. Kira Gleason,"[""Illum sed aut autem corporis. Cumque non iure expedita voluptatem qui enim suscipit. Sequi ut maxime dolorem. Consequatur hic voluptatem a sit nulla nemo saepe. Placeat enim ut."", ""Ad nostrum eum enim omnis blanditiis porro cum. Libero natus soluta. Odit perspiciatis eaque. Soluta animi sed corrupti qui et."", ""Sed cumque corporis et doloremque ea. Eum et aliquam deleniti facilis. Non possimus animi. Voluptatem facere perspiciatis optio tenetur sunt. Neque doloremque magnam."", ""Minima laudantium illum ea cupiditate. Reiciendis sed quaerat hic. Nesciunt ipsum est reprehenderit est iusto ratione. Quia sed aliquid. Eos omnis facilis magni enim."", ""Ullam labore voluptas. Sit molestiae ea. Ad est illo."", ""Et nam et ut qui facilis minima. Quo ab ipsam officia et eum eaque. Minima quidem minus error perferendis eaque explicabo nesciunt.""]",airplane.jpg
Dolores quia error quia ut ullam.,Ms. Noelia Hilpert,"[""Eveniet voluptatem et qui soluta. Ullam ex ut. Sit pariatur nihil. Repudiandae voluptatem delectus. Consequatur pariatur nesciunt."", ""Ab nobis vitae. Totam quod enim et quia deleniti voluptas debitis. Est quos velit odio similique nostrum est doloremque."", ""Hic ducimus cumque numquam sed. Aliquam odio tempora consequatur. Libero molestias facere accusamus fugiat."", ""Sint quidem provident consequatur. Distinctio itaque sit expedita amet accusantium dolores exercitationem. Est consequatur sint repellat modi exercitationem. Ea consequatur repellendus iste soluta voluptatem. Cumque repellendus ea impedit voluptatem accusamus optio."", ""Provident eaque voluptates aliquam. Sed nostrum exercitationem eligendi est. Debitis laborum dolores mollitia et est. Est aspernatur inventore. Dolor qui ratione."", ""Doloribus omnis non et dolorum ipsum. Non soluta ut. Molestias ut sunt. Accusamus officiis et.""]",beach.jpg
In repellat sit dicta incidunt et voluptatem.,Dessie Sawayn,"[""Et cumque consequuntur et pariatur. Est inventore eaque ad omnis. Nihil excepturi quos facere ratione. Dolore corporis totam qui odio maxime numquam ratione."", ""Qui animi expedita dolorem et ipsum minima. Molestias et aliquam. Optio debitis quis excepturi. Enim accusamus voluptate voluptatum est in neque atque."", ""Velit rem veritatis vero. Autem quo eos dolores. Quasi consequatur illum soluta minima quo culpa et. Deleniti quam nesciunt fugiat dolorem aut.""]",beach.jpg
Aut voluptatem vel.,Dr. Davonte Ledner,"[""Assumenda repudiandae reiciendis et molestias sunt eaque. Ut at sit ea quibusdam blanditiis. Provident perferendis architecto fugiat. Dignissimos laudantium accusantium blanditiis."", ""Ut ipsum odit et laboriosam autem eos occaecati. In qui tempora odit voluptatum magnam omnis. Vel distinctio repellat."", ""Et voluptate facilis. Esse qui incidunt laboriosam quisquam rerum eveniet rem. Qui voluptatem aut nobis. Qui modi magni amet ipsa ut. In culpa provident quia id minima."", ""Quia ea praesentium voluptate rerum omnis deserunt. Sequi placeat quam dolor. Quis minus veritatis ex impedit.""]",beach.jpg
Veritatis vel vitae molestiae assumenda quis occaecati.,Dr. Stephan Leannon,"[""Deleniti nobis sit officia ipsa enim. Dolores sed adipisci non. Aut ad animi dolor voluptatem tenetur. Voluptas nam ducimus quia ullam. Aliquam qui quia impedit eum fugit similique omnis."", ""Quaerat labore nihil hic qui recusandae fuga. Iure provident quibusdam ab dolorem non voluptatem. Fugit non aspernatur dolorum quos eius et qui. Cum et et alias. Quod est voluptas ab."", ""Nobis quaerat velit ex sequi asperiores repudiandae autem. Vel id ipsam eligendi similique aperiam dolore repellat. Aut iusto eveniet. Et doloribus est voluptates."", ""Accusantium ut temporibus cupiditate inventore. Cumque beatae cupiditate illo tenetur et possimus corporis. Saepe temporibus voluptatibus consectetur qui laborum est."", ""Adipisci nesciunt itaque saepe accusamus placeat. Et ipsum nemo placeat explicabo animi. Ut porro veritatis sunt. Animi ipsam magni quisquam fuga est ratione."", ""Quae autem perspiciatis atque eaque. Corrupti aut maxime libero. Ab dolor itaque porro. Et dolore aut quidem ullam. Libero ut deleniti provident."", ""Quam corrupti aut adipisci. Soluta est commodi fugiat beatae accusamus iusto. Eligendi sit aut nihil accusantium sequi."", ""Illum animi ducimus fugiat repellendus quia dolorem. Quo illo excepturi voluptas optio. Eum quos est aliquam. Voluptas architecto rerum suscipit itaque assumenda."", ""Ad nostrum tenetur fugiat quas. Maiores est non mollitia expedita facilis. Ut velit iste rerum aut voluptate. Expedita ducimus nam ut ad distinctio rerum. Nemo ut omnis voluptatem pariatur ratione non."", ""Fugiat a delectus in ut. Eos consequatur est. Repellendus quaerat assumenda molestiae magni sit explicabo et. Odit excepturi numquam et nihil praesentium est. Minima et nam velit.""]",beach.jpg
Aut ipsam quod accusamus corporis dolore magni eius.,Griffin Lehner,"[""Eum ratione nostrum. Aspernatur dignissimos vero autem a incidunt suscipit qui. Eum placeat ea doloremque temporibus dicta. Harum praesentium optio."", ""Voluptatibus voluptas sed quos. Dicta nam reprehenderit et. Adipisci quae labore fuga sed voluptatibus. Mollitia omnis sed fuga blanditiis quas."", ""Doloribus voluptatibus doloremque qui qui ut dolorum quia. Est rerum cupiditate. Numquam dolorum odit est magni.""]",beach.jpg
Distinctio numquam porro ut aut aut.,Ms. Caesar Zboncak,"[""Ipsa expedita dolores aut non quo assumenda ut. Necessitatibus sed possimus quia aperiam. Similique accusantium repellat et. Sunt facere delectus."", ""Error non quasi quis labore ut non. Esse dolores et consectetur minima. Voluptatem voluptas provident nihil aut qui qui. Quia qui et dicta modi."", ""Quo quae impedit possimus doloremque quisquam. Est explicabo delectus fuga est distinctio dolores. Sit ea est nisi non modi aut."", ""Quia asperiores odit repellendus aut. Mollitia et ut quaerat veniam perferendis. Natus omnis a explicabo quia maxime. Omnis fuga enim et et fugiat. Dolores ducimus earum ea."", ""Doloribus ipsam sed beatae facilis. Quia sint in voluptatem autem eveniet odio. Quia magni veritatis temporibus atque. Quasi aut optio explicabo neque. Ab iure adipisci."", ""Maiores voluptatem autem. Vel illum voluptatem assumenda. Iure rerum magni et aperiam consequatur. Quia earum id excepturi voluptas laboriosam."", ""Minima neque autem quae ex. Rerum quia nesciunt consequatur qui. Dignissimos sapiente culpa facere repellat consequatur nam. Eveniet explicabo modi ipsa neque. Earum sint eum hic."", ""Quis soluta tempore at delectus alias nihil. Sunt doloribus quas. Reprehenderit et quia distinctio."", ""Aut voluptatem perspiciatis quasi officiis. In deleniti qui voluptatibus est quidem consequatur. Maiores facere qui ex eligendi quibusdam et.""]",airplane.jpg
Similique necessitatibus totam eaque et dolores.,Rosina Dickens,"[""Voluptatem dolorem nam voluptate voluptatum omnis. Suscipit ratione temporibus consequatur. Sint maxime qui omnis rem omnis totam provident."", ""Cupiditate corrupti ratione voluptas beatae. At consequatur consectetur cum. Ab repudiandae illo. Ipsa voluptate cum."", ""Laudantium qui et eius quam tenetur repellendus dignissimos. Architecto odio ea cumque ut eum tempore praesentium. Maiores sequi optio. Voluptate earum delectus magnam sapiente accusantium ullam."", ""Optio aliquid quidem molestiae tempore ducimus. Sapiente cum natus officiis quia. Ipsa vitae et ut sed voluptas aperiam nihil. Voluptatibus ut amet architecto. Similique maiores quam facilis quae."", ""Alias provident repellat sunt dignissimos. Vitae esse pariatur accusamus dolorum corporis totam dolores. Maxime sunt repudiandae dolor a."", ""Ut nulla qui. Quas blanditiis maiores perferendis sint velit eos est. Error doloremque dolorum libero porro in ut. Quaerat asperiores ut. Corporis voluptatum fuga voluptas eos."", ""Iusto alias aut labore similique sunt. Totam omnis mollitia quia impedit aut quos sapiente. Molestias beatae aut eligendi aperiam optio labore. Officiis dolores minus doloremque dolor ut. Officia provident neque architecto accusamus."", ""Maiores animi rerum. Et qui est nihil magnam molestiae sunt voluptate. Sit ipsum assumenda itaque natus et. Exercitationem sit autem voluptas accusamus aperiam perferendis. Ullam dolor quo corporis accusantium repellat."", ""At qui fuga quia natus deleniti. Iure ut est ad voluptatem aut est earum. Id veritatis omnis enim eius quo beatae nihil.""]",beach.jpg
Non itaque nobis architecto quae blanditiis voluptatum.,Marco Davis DDS,"[""Totam non sint. Et corporis sed. Quod sed adipisci perferendis in voluptatum recusandae. Qui animi laudantium aut laboriosam sequi. Eaque sed officiis dolor."", ""Ipsam ad neque quos aperiam. Nesciunt sequi nam debitis. Non sit officiis quia dignissimos accusantium corporis."", ""Quo odit qui itaque tempora officia veniam vitae. Corrupti nihil reprehenderit. Dignissimos nihil excepturi magnam voluptas accusamus inventore similique. Sed voluptatem aut est officia vitae itaque veritatis."", ""Quia voluptatem quo distinctio amet quibusdam aut ipsum. Pariatur veniam in repudiandae. Eveniet molestiae vel quos ad eligendi."", ""Corrupti consequatur et quod placeat et at non. Laborum facilis veritatis non aut ut. Qui rerum sint distinctio aspernatur et dolores."", ""Eius natus cum. Ut saepe non iste beatae. Qui corporis architecto et quod."", ""Vitae est ex voluptates sit a. Debitis perspiciatis ut fuga et labore dolorum iure. Facere itaque amet assumenda quo. Molestiae sed quis iusto."", ""Quam corrupti ut esse temporibus cum maxime dicta. Occaecati minima assumenda doloribus dolores et aut. Deserunt debitis nisi."", ""Qui illum et maxime maiores quis in est. Optio id id ad aut magnam. Eligendi ducimus minus. Ut non ipsa nihil doloribus et excepturi nobis. Accusamus soluta quia reiciendis quos qui."", ""Exercitationem ipsa est laudantium dignissimos delectus cum. Recusandae aperiam dolorum. Distinctio ut tenetur mollitia at modi vitae molestiae. Dolores ut hic doloremque qui et.""]",beach.jpg
Omnis laborum facere omnis.,Eda Mayer DDS,"[""Eligendi molestiae quia quis fugiat corporis. Dignissimos possimus cumque voluptas dolores expedita explicabo deserunt. Nemo harum ipsa reiciendis animi aut. Nesciunt sit repellat cum itaque. Sit aut assumenda ullam ab sapiente sint tenetur."", ""Eligendi ut consequuntur. Rerum eum qui. Consequatur placeat non aliquid iusto cumque. Error soluta quam nostrum quo est. Veritatis enim numquam."", ""Est sapiente qui veniam ut sint voluptatem saepe. Ut perspiciatis facere illum. Incidunt reprehenderit est."", ""Est voluptatem quas nesciunt reprehenderit minus est repellat. Reiciendis libero est quibusdam repellat ipsa. Et et itaque culpa nemo debitis eius. Rerum sint omnis autem ut."", ""Placeat illo et distinctio nemo. Hic et dolorem deserunt. Voluptatem ut ea."", ""Quia voluptate tempore. Ut consequatur illum voluptates inventore omnis veniam quas. Et rerum sed corrupti. Veritatis ipsam culpa."", ""Quo blanditiis est facilis quis eaque. Quo et vel. Et et est."", ""Dolor exercitationem ex. Qui aut occaecati. Nihil omnis modi quis. Vitae necessitatibus vero adipisci ab dolor.""]",beach.jpg
Nobis optio eaque quo.,Caterina Batz,"[""Earum veritatis vel soluta ut. Doloremque earum voluptate. Doloribus autem et ab quam itaque totam."", ""Maxime omnis qui ea eum aut. Et velit error. Aspernatur tenetur aperiam. Optio consequatur voluptatem eveniet ratione veniam dolorem rerum."", ""Id sed ullam sed. Quis earum aut tempora eveniet voluptatem. Eos et enim. Et dolorem dolores cum sint qui."", ""Quia nemo quia labore molestias libero officia voluptas. Vel nemo fugiat molestiae. Natus perspiciatis tenetur officia accusamus harum. Aliquam explicabo molestiae accusamus non. Et atque voluptas veniam voluptatem id."", ""Aut amet nisi nihil quos. Velit aut placeat at assumenda. Voluptatem rerum maxime voluptas."", ""Vero ea fugit. Facilis explicabo quam necessitatibus inventore. Et dolorum quisquam voluptas. Similique et veniam rerum amet veritatis et fuga."", ""Velit sit eos veritatis tempora quidem quis tempore. Occaecati commodi voluptatum molestiae ut. Et assumenda accusamus amet debitis. Iusto a dolorem."", ""Ex dignissimos sint nihil ullam sit est. Id nihil distinctio doloribus tenetur minus ea quia. Reiciendis distinctio magnam omnis et ut ut. In voluptatum explicabo nostrum qui. Repellendus qui quibusdam ut."", ""Nesciunt ipsa consequuntur quia sapiente voluptates fuga. Quis enim perspiciatis. Optio enim omnis et placeat vitae. Ut facere reprehenderit quia.""]",airplane.jpg
Soluta enim nihil.,Miss Jamie Kirlin,"[""Tenetur qui distinctio voluptatem sunt molestias quia. Non provident accusantium. Sed pariatur ut nesciunt consectetur."", ""Reprehenderit nisi aut in. Illo porro animi eligendi. Et inventore magni ex natus atque eaque eos."", ""Rerum sed eligendi optio ex voluptatem. Architecto rerum modi a non optio. Error officia qui officiis aspernatur harum. Perspiciatis reiciendis voluptatum sed."", ""Aut laudantium provident voluptate voluptatibus eveniet omnis exercitationem. Dignissimos quis in rem autem error numquam inventore. Harum odit et doloribus voluptatem dolorum illo."", ""Dignissimos dolore ipsam eligendi excepturi vel doloremque inventore. Culpa sit et. Explicabo error dignissimos voluptatem libero iusto voluptatibus."", ""Accusamus ut et facilis. Vel velit repellendus accusantium optio laborum qui consectetur. Nisi aut ducimus vero. Nulla eius quas eum velit. Harum impedit rerum eius asperiores quo tempore."", ""Porro saepe et maiores. Iste quis quia et. Aut corrupti vero error molestiae. Officia sapiente qui sit voluptas est quis.""]",beach.jpg
