title,author name,body,hero image
Libero officia quod harum omnis laborum animi doloremque placeat.,Jennie Goyette,"[""At mollitia repellat. Et sunt asperiores adipisci maxime. Ut eligendi explicabo saepe. Sit omnis consequatur. Et consequatur tenetur."", ""Beatae est sed porro ut et. Omnis in aperiam eos. Mollitia laudantium vero illo. Vel esse voluptatibus quae ducimus facere."", ""Et ducimus corporis placeat tenetur quasi. Non quo autem. Ut harum voluptate deleniti explicabo."", ""Accusantium sunt corporis saepe reiciendis. Fugiat at in. Porro consectetur provident."", ""Exercitationem qui qui. Suscipit voluptatum dolores porro. At dolores autem nulla nostrum.""]",airplane.jpg
Suscipit dolor quia et.,Joseph Pagac,"[""Exercitationem non dolor sunt modi doloribus aperiam consequatur. Deserunt qui adipisci nostrum nam et voluptate. Doloribus fugiat rerum numquam possimus porro eligendi aut. Distinctio ab veniam aliquam enim dolore."", ""Saepe nobis deserunt aut. Unde sit id tenetur. Velit saepe molestiae. Recusandae ut id."", ""Ab vel voluptas est accusamus officia et. Molestiae blanditiis consequatur. Ex dolor sunt."", ""Placeat tenetur nostrum blanditiis sit ut repudiandae officia. Omnis voluptatum voluptas inventore. Aut reiciendis laborum voluptatem est voluptas voluptas qui. Dignissimos numquam voluptatum quos. Rerum sit voluptate enim corrupti suscipit eum."", ""Ut voluptatem corrupti qui enim quaerat voluptates quos. Repellat adipisci pariatur sit nisi voluptatem unde. Dolorum perferendis delectus. Delectus molestiae voluptas architecto aut dolor eos. Et aperiam aut in dolore."", ""Quia temporibus atque est. Eum iste deleniti. Illum placeat temporibus voluptas impedit dignissimos ut enim. Eligendi sit tenetur quibusdam et fugit. Et recusandae quaerat est."", ""Itaque repudiandae neque omnis quia possimus. Dolor aut laboriosam. Error dolores beatae repellendus facere et et fugiat. Eveniet officiis id sed aut ex dolores."", ""Ex quam aut et magni. Nostrum id quo. Et temporibus quo blanditiis error ut. Quos harum voluptatum omnis repudiandae."", ""Harum eius et qui. Iusto sit temporibus aut. Exercitationem tempora aut."", ""Culpa laborum nisi ut. Eligendi placeat dignissimos quia consequatur est eum eum. Blanditiis dolor in iusto rem cumque. Maiores qui praesentium. Excepturi distinctio unde ipsum nihil ipsa vel.""]",airplane.jpg
Pariatur quia veniam ut sed esse sint qui.,Ruben Kohler,"[""Eveniet voluptas beatae veniam assumenda natus. Doloribus et quia. Ipsa sed nihil. Dolor numquam autem. Eos aut dolores."", ""Nulla pariatur accusantium et commodi voluptate non magni. Aut aspernatur ullam. Ut veniam architecto eius."", ""Ea beatae ut occaecati dignissimos. Et alias laboriosam. Reprehenderit consequatur aut repellat nemo. Accusantium a rerum qui facere quia non assumenda. Recusandae non velit."", ""Necessitatibus delectus eos facilis dolorum qui et. Ut accusamus voluptatem aspernatur et. Nostrum iure commodi beatae iste cum veritatis. Quia enim illo voluptatem earum placeat. Culpa vitae iste qui veritatis velit et facilis."", ""Molestiae reprehenderit distinctio esse facilis. Omnis laborum ratione iusto dolorem incidunt aperiam. Tempora aut provident magnam molestiae ipsam cumque. Harum suscipit voluptatem non quia explicabo tempore inventore."", ""Numquam voluptas ipsam aut. Eos et id molestiae possimus quod repellendus rem. Rerum impedit accusantium. Aliquid eum quae est ea rem recusandae minima. Itaque officiis delectus et labore quia.""]",beach.jpg
Accusamus praesentium quis voluptates aut voluptatem.,Keara West,"[""Et et molestiae ut eum. Ut esse voluptas tenetur aliquam quo. Beatae nemo vel qui."", ""Quasi et voluptatibus. Deleniti quasi magnam rem consectetur reprehenderit unde. Voluptatem totam eligendi voluptas ut dolores. Expedita eius velit pariatur ducimus cumque quis. Sequi explicabo ab voluptatem itaque ullam laborum et."", ""Odio maiores possimus quisquam quibusdam aliquid eum. Mollitia quia excepturi in facere omnis. In aliquid voluptate occaecati."", ""Et omnis aut. Repellat nostrum quibusdam earum sapiente quas. Explicabo eligendi aut assumenda asperiores eos sit."", ""Voluptatum deserunt maiores quia aliquid. Sit laborum nisi. Est dolor qui quibusdam voluptatem aperiam."", ""Itaque blanditiis commodi et. Enim dolor nihil vel distinctio maxime delectus adipisci. Consequatur quos quod et et quisquam."", ""Consequatur nam asperiores hic et ut. Quod reprehenderit sit aut aut. Minima vel beatae excepturi."", ""Quia non alias non. Alias aliquid laborum eligendi soluta architecto. Aut laborum commodi sunt totam ullam quam."", ""Quas molestias sed hic. Laudantium reiciendis dolor minima esse accusamus et neque. Facilis in doloribus qui.""]",beach.jpg
Inventore laborum quos distinctio quibusdam temporibus.,Turner Wisoky,"[""Quia deleniti molestias aspernatur voluptatem. Expedita quia dolore et. Iure placeat illo esse et a deleniti. Nesciunt laboriosam qui dolor ipsa minus."", ""Illum necessitatibus quod ut ipsum dolore aspernatur. Expedita et maiores cupiditate temporibus dicta voluptatem. Quia harum quia id maiores molestiae et rem. Itaque at soluta similique dolorum."", ""Placeat sunt mollitia qui quidem voluptatibus. Quis alias consequatur et. Earum veniam numquam sed error qui reprehenderit dignissimos."", ""Sunt laudantium deserunt. Nam veritatis ullam. Et hic labore laborum ea ut. Autem voluptas in et dolorem. Omnis et labore tenetur voluptas molestias."", ""Quis doloremque quidem omnis et necessitatibus autem. Reiciendis et sunt placeat. Inventore quia qui ipsum sapiente adipisci. Consequatur sequi sed voluptatem blanditiis consequatur atque."", ""Dignissimos porro sed ab odio recusandae qui. Eveniet molestiae at sequi est itaque illum. Iste ipsum quis consequatur quo quisquam."", ""Dolorum sed distinctio quidem perspiciatis qui minima provident. Nemo officiis ipsa reiciendis tenetur tempora rerum perspiciatis. Et repudiandae aut assumenda fugiat neque cumque nihil. Dolor id voluptatum quia."", ""Reiciendis voluptas voluptas. Rerum quis voluptatibus sint rem earum. Temporibus culpa quibusdam. Sit ex at ut tempore.""]",beach.jpg
Culpa neque delectus sequi ut nostrum.,Jennyfer Kessler,"[""Recusandae aut enim. Dolores quia excepturi. Magni non aut eum."", ""Quaerat qui enim officia. Eos aperiam non est facilis iure accusantium. Natus facere veritatis cupiditate et veniam ipsum aut."", ""Eum eos ut sit totam accusamus est. Quibusdam aperiam maxime. Aut quis nam non. Labore qui ducimus totam saepe quod est a."", ""Cum aliquid molestias ab et nihil tenetur. Sit suscipit commodi quam ut. Non modi beatae reprehenderit sed ipsam error quia. Sunt hic esse sunt tenetur. Ea qui consequatur animi."", ""Laboriosam aut voluptas quaerat consequatur ut voluptatem. Enim aspernatur reprehenderit. Nostrum velit cum voluptates dolorum iusto."", ""Neque cumque possimus doloremque inventore. Cumque tempora deserunt quis. Consequatur quos eos quia dolorem consequatur quis."", ""Deleniti debitis natus harum. Ullam praesentium eos alias voluptatem nostrum quia. Est id alias non. Corporis ut optio consectetur repellat voluptate minus. Sint autem in est accusantium."", ""Doloremque quia qui error soluta delectus. Qui ea molestiae repudiandae quis ut quos. Voluptatem eaque nesciunt inventore eveniet. Enim blanditiis minus soluta optio. Architecto incidunt maiores minus quod et."", ""Voluptatem deserunt excepturi facilis nesciunt. Iste quis pariatur non veritatis. Praesentium earum reiciendis consequatur consequuntur. Quod maxime tempore non et non.""]",airplane.jpg
A suscipit ea dolores.,Jovan Monahan DVM,"[""Ex quidem inventore. Quia accusamus expedita. Fugiat distinctio qui sunt."", ""Ipsam nobis voluptatem qui. Expedita aut sed perspiciatis fuga dolorem. Error est incidunt quasi facilis. Rerum laborum sit."", ""Natus perferendis non voluptas tenetur et. Quia similique voluptatibus praesentium quo est recusandae. Libero dolore aut assumenda quia."", ""Quaerat quae deleniti rem maiores perferendis. Ut nam sed ratione. Explicabo rem natus qui quibusdam recusandae doloribus. Incidunt autem sunt consequatur vel deserunt numquam. Animi enim dolore veritatis."", ""Maxime dicta similique sunt. Est molestiae autem suscipit qui. Et velit minus."", ""Corrupti et provident ut sunt at autem eum. Eos voluptatibus a voluptatem odio. Neque nulla aliquid recusandae sit qui. Minima qui omnis et nisi. In rerum dicta et ut.""]",beach.jpg
Sequi quos quod et dolorum minima magni.,Andreane Hilll,"[""Occaecati quisquam voluptatum adipisci. Vitae vero perspiciatis aspernatur corrupti. Saepe error at ipsum minima soluta. Aut ad earum velit. Non velit facere."", ""Voluptas molestias rem deserunt exercitationem. Ut molestias ipsam quis voluptates deserunt. Et qui sit ut aut dolore quasi. Perferendis dolorem aliquam."", ""Consequatur qui atque placeat. Voluptas ad minima quasi sit. Molestiae quaerat labore dolorum voluptas distinctio sed. Omnis animi harum ut totam ducimus.""]",airplane.jpg
Nostrum autem consequatur mollitia.,Mr. Jose Schroeder,"[""Fugiat molestias itaque magnam id iste tenetur qui. Earum id magni. Ducimus quos atque."", ""Sint laboriosam saepe voluptatum molestiae sed voluptatem molestiae. Quia culpa facilis. Necessitatibus molestiae voluptas excepturi qui. Occaecati voluptas hic qui sunt quidem repellat. Ullam consequatur aspernatur nemo sunt quis voluptas."", ""Natus odit omnis nulla laudantium neque. Et sed repellendus laudantium quam aut. Eum voluptate nam doloribus nostrum."", ""Et qui sed repudiandae consectetur. Accusantium a consequuntur laudantium dolorem. Eum nesciunt autem fuga dolorum maiores."", ""In nam omnis sed enim optio. Rem laudantium in dolores. Adipisci sed eveniet alias voluptas. Unde qui asperiores eos non vero quis."", ""Dicta tenetur iusto accusantium qui. Omnis qui accusantium ut sunt quis ea maxime. Sequi aut atque magnam fugiat. Et corrupti ut.""]",beach.jpg
Commodi doloremque aliquam.,Doris Muller MD,"[""Ut sint in accusamus qui id commodi quibusdam. Rerum animi cupiditate. Fugit temporibus iste porro voluptate beatae provident tenetur."", ""Rerum veniam aut illum iure. Ut voluptatem nisi natus maxime est voluptatem. Sapiente est impedit nam quia est. Aspernatur molestiae dolorum nostrum in. Nihil ut repellendus."", ""Voluptas fuga quisquam ea culpa suscipit nobis illum. Enim voluptatem dolor. Delectus sed tempore voluptatum dolores."", ""Fugit molestiae autem cupiditate. Quidem et id reprehenderit quis voluptas. Expedita cum aut quia ipsa. Enim aut ut qui modi quaerat assumenda."", ""Excepturi odio ab sit fugiat. Amet qui ab ea facere. Est nihil accusamus et non asperiores laborum. Deserunt nam molestiae in libero."", ""Voluptate illo asperiores. Quia accusamus voluptatem consequatur impedit recusandae eaque quasi. Repellendus sunt quo eum."", ""Nulla iure quia cum consequatur quia ex. Natus vero et. Inventore sapiente explicabo eligendi. Dolor autem cumque et ad aperiam facere ut. A eos voluptates voluptas."", ""Esse deleniti eius est aut at sunt. Nihil odio est iste pariatur eum minima. Aliquam quis aut nemo. Culpa aspernatur maiores ullam distinctio cumque voluptatem. Id occaecati et."", ""Natus aut culpa et. Corrupti sint eius sint alias. A molestiae reiciendis sit illum sunt adipisci.""]",airplane.jpg
Adipisci harum et.,Maybelle Hudson,"[""Dolor dolorum doloremque ipsam doloribus velit fugiat. Officia et sit voluptatum sed. Est ab dolore eveniet voluptatem."", ""Voluptate optio porro fuga corrupti. Natus rerum sit. Magni dolorem rerum reiciendis omnis consectetur."", ""Dolor sint ut placeat. Quod fugiat libero ipsam nulla sit. Voluptatem quas consectetur odio fugit. Asperiores consequatur architecto ea quia."", ""Accusantium debitis consequatur. Vel atque unde molestias laboriosam reprehenderit incidunt. Quia quo dolorum libero. Ratione quam fugit alias consequatur voluptas. Et inventore cum laboriosam consequatur illum."", ""Molestiae est dolore sapiente aut qui ea distinctio. Reprehenderit unde et saepe corrupti autem cum libero. Atque eius tempora in necessitatibus. Sint beatae omnis pariatur dolorem quia quis.""]",beach.jpg
Ut et nam optio suscipit.,Presley Rippin,"[""Hic quibusdam optio fugit. Eveniet quia dicta. Rem qui voluptatem et dolorem nihil explicabo."", ""Voluptates rerum omnis molestiae nihil vel ratione. Qui magni eos voluptates et magnam omnis. Dolorem animi magnam omnis. Est et quia reiciendis nemo facere itaque."", ""Animi cum quia ut et qui sit ut. Facilis consequuntur iste cumque ratione. Excepturi et voluptatem quia sed."", ""Et dicta non inventore est veniam et sunt. Natus aut odit eligendi reiciendis. Maxime facilis vitae ea odio. Error consectetur voluptatem eos facere."", ""Nihil impedit eos maiores vel saepe beatae est. Optio qui sunt ex. Et cumque molestiae rerum ut. Repellat rem aut minus. Neque quis et rem similique nulla omnis qui."", ""Voluptas iste veniam ipsam alias illum. Architecto quae tenetur quod culpa aut officiis. Non unde voluptatem. Libero dicta officia quia doloribus quisquam. Quasi nihil maxime nesciunt dolores corrupti fugiat."", ""Et ipsam repellat qui culpa. Excepturi architecto culpa quibusdam vero. Quia error ea ut a inventore reprehenderit sint."", ""Asperiores velit sed similique omnis. Est sint cum. Id eum impedit nobis ab consequatur animi consequatur. Facilis ullam necessitatibus."", ""Nostrum nihil ducimus autem beatae ut consequatur quam. Perspiciatis quidem quaerat aut enim fugit. Distinctio aspernatur illum eaque doloribus. Nihil asperiores quidem consectetur."", ""Ut doloremque earum laboriosam voluptate vero maiores. Repudiandae quo minima nulla sunt velit velit. Eligendi omnis rerum.""]",beach.jpg
Et sed nihil occaecati voluptatem.,Davon Klocko Jr.,"[""Cumque et et aut. Veniam quia mollitia totam ratione. Similique architecto itaque maiores non est."", ""Nemo qui laboriosam eos quis. Ducimus ut et asperiores. Quisquam porro facilis et molestiae. Accusamus facilis sit aliquam sapiente velit. Quas cum eligendi aut sed numquam voluptas."", ""Magni reprehenderit aliquid temporibus at itaque sapiente. At dolor et a id harum id. Atque ad similique. Repudiandae provident fugit. Sit eum quis qui repellendus sint."", ""Repellat et qui repudiandae. Et dicta consequatur eius officiis. Sed illo facere quo."", ""Sunt quibusdam voluptatum corrupti. Eius unde voluptatem quo perferendis. Laboriosam est eius quia facilis numquam.""]",beach.jpg
Vero est quia ut.,Spencer Maggio,"[""Esse qui necessitatibus sit molestiae. Ea magni aut. Velit aut repellendus. In id et. Ipsa velit id ut."", ""Et voluptas corrupti. Ullam occaecati dolores. Iure qui magni iusto laboriosam alias. Ut non harum quam vitae voluptas."", ""Neque consequatur iusto. Ut neque fuga suscipit. Doloribus aspernatur provident excepturi et nam sed."", ""Eius ut itaque odit ad officiis deleniti. Eum occaecati sed. Ducimus quia sed enim. Odit incidunt et aliquam facere.""]",beach.jpg
Perspiciatis suscipit dicta quas officia molestiae.,Makayla Nicolas,"[""Minus ad quia beatae explicabo et. Quis odit dolores ullam. Id dolorem eos saepe explicabo aspernatur molestias officiis. Et nostrum voluptatem voluptas quidem similique eum."", ""Maxime ut officiis exercitationem sunt laborum. Quia illo recusandae laudantium dolorem cum at. Recusandae voluptatum qui et odit at placeat. Consequatur harum tenetur quisquam aliquid enim. Tempora adipisci consequatur dolor iste rem."", ""Mollitia inventore cupiditate enim at modi. Neque excepturi quas incidunt ea. Ad et earum neque ea quam sint."", ""Veniam enim modi dolore ut. Aliquam vel ut est sed inventore. Veritatis dolor rerum iure eos. Veniam modi fugiat vel ea eos."", ""Aperiam quod cumque architecto et doloremque. Ea saepe sed. Nobis numquam corporis ut vel ut labore. Nostrum nemo facilis dolor exercitationem aut qui."", ""Autem dolore sed quisquam iusto animi quibusdam occaecati. Enim ratione quisquam dolor saepe aperiam sed atque. Nihil voluptatem placeat et. Dolor laudantium harum libero. Quia voluptatem ut commodi nesciunt quo sapiente aliquam."", ""Sint sit aliquam omnis in enim ipsa. Voluptatem aut est fuga molestiae voluptas aut. Et earum similique cum quia nobis quod.""]",airplane.jpg
Et non eum veniam autem.,Felton Pfeffer,"[""Ut alias omnis qui dicta quo repellat. Ratione tempore numquam voluptatum vero recusandae illo dolorem. Fugiat exercitationem recusandae magni rem."", ""Dolore officia est. Dolorem at non. Sunt eveniet illum."", ""Sint perspiciatis praesentium ipsa voluptatum amet. Aut et repudiandae sit. Architecto aut illo. Consequatur a iure sint iste voluptates delectus eligendi. Natus porro veritatis."", ""Suscipit ea occaecati velit est corporis. Aut saepe repellat enim. Ut dolore reprehenderit rerum sed rem voluptas nisi. Dolore earum sunt qui quia. Quidem quae error quam amet assumenda."", ""Tempore eum saepe. Rem corrupti totam voluptate dolores quidem debitis delectus. Et et fugiat facere soluta occaecati ad officiis. Mollitia in exercitationem ipsum libero unde error."", ""Explicabo sit incidunt quae cupiditate accusantium. Incidunt qui et praesentium. Id natus quo omnis."", ""Ut optio consequatur voluptatum vel et expedita veritatis. Et ipsum tempore nobis et neque at minus. Et libero qui."", ""Recusandae beatae consequatur tempore dolorem. Praesentium maiores ipsa necessitatibus. Autem fuga voluptatem et."", ""Quidem earum est quos vero et corrupti aut. Quidem id velit qui repudiandae reprehenderit. Tempore fuga praesentium laboriosam."", ""Labore officia repellat qui sed. Natus dolor adipisci sed. Sit possimus quod. Assumenda odio ipsum ullam.""]",airplane.jpg
Voluptas labore et adipisci sit.,Emmalee Champlin,"[""Id sed distinctio doloribus consequatur. Modi optio eaque sed illo illum. Ipsa voluptatem non aliquid deserunt suscipit. Molestiae architecto accusamus nihil atque ratione. Qui praesentium modi quia."", ""Nisi dolores nulla alias inventore voluptates. Aut est est sit. Amet ex cupiditate non ducimus debitis. Commodi doloremque ipsa voluptates."", ""Corrupti ipsum tempore explicabo error soluta. Velit ratione molestias et consequuntur ut molestiae voluptate. Qui fuga ex."", ""Odio tenetur laborum adipisci. Illum rerum consequuntur dicta pariatur autem. Nisi deserunt harum quasi rerum. Voluptas libero ea. Modi assumenda consectetur quis."", ""Itaque error atque. Quod eos sunt repellat id eos. Reiciendis nulla et sint non deleniti exercitationem."", ""Animi eligendi ipsa et. Accusantium aut maxime sed. Distinctio reiciendis eaque totam."", ""Omnis sit occaecati consequatur incidunt. Laboriosam id sit officia enim voluptas. Cum est aut rem voluptatem excepturi."", ""Dolor aut eaque veniam soluta cupiditate mollitia. Iste ea aut ipsum numquam id. Similique recusandae est minima omnis quasi neque. Vitae quis sed aliquam. Minus voluptatum commodi voluptate aliquid quasi.""]",airplane.jpg
Repudiandae et aut.,Ofelia Trantow,"[""Dolore eum sed ipsa voluptatem. Voluptatum tenetur molestias molestiae ut expedita quas. Facilis eum consequatur pariatur est amet voluptates."", ""Dolor laborum odit. Enim sed voluptatibus ex voluptatum neque. Consequatur dolorum voluptas."", ""Aspernatur tempora et natus omnis magni. Nihil veritatis esse labore id voluptatem. Consequatur culpa voluptas qui quis dignissimos quibusdam."", ""Et repellendus nulla aperiam sed libero et ex. Ut tempore est temporibus et ab pariatur. Quisquam assumenda commodi rerum quaerat dolor nihil. Tempore dolor ut aut repudiandae ut. Minima cum officia."", ""Ut quas excepturi suscipit. Consequuntur ea soluta. Minus sint sit. Quo voluptas unde eos et aut."", ""Temporibus et et ea cupiditate. Repudiandae quasi et explicabo illum ad dolorem. Voluptas velit fugiat reprehenderit nesciunt. Est culpa voluptatum quis eligendi ducimus ut vitae."", ""Qui dolorum odit. Et impedit explicabo labore autem dolores consequatur. Adipisci labore pariatur omnis nam optio. Sint nihil fugiat inventore sit rerum consequatur. Blanditiis cupiditate consequatur explicabo omnis natus quia quisquam.""]",beach.jpg
Qui qui tempore occaecati ipsum ut.,Santiago Fahey DVM,"[""Asperiores qui odit ut reiciendis et. Unde id consequatur qui. Odit corporis quod earum rerum libero illum aliquid. Sit sunt aliquam enim temporibus iure."", ""Qui quaerat impedit praesentium. Id nihil voluptatem. Excepturi sit esse quaerat voluptatem."", ""Aut dolor odit sequi ipsam magni facilis voluptatem. Sunt sit dolores dolore doloremque et eligendi. Et sit libero accusamus. Velit laboriosam aut quidem quis qui enim dicta. Excepturi quas odit sunt iste non at in."", ""Iure amet sit similique maiores qui. Ratione incidunt enim aut vero placeat. Omnis inventore voluptatem. Et neque occaecati incidunt saepe quasi impedit quibusdam."", ""Autem doloribus assumenda voluptatem temporibus. Cumque ut soluta quo illum voluptate maxime animi. Aliquid odit rerum tempore. Voluptatem eum vitae culpa commodi dignissimos. Non qui doloremque quam sint aut."", ""Sint nam in quia et sunt facilis consequatur. Qui voluptatem a excepturi repellendus aspernatur ex fugiat. In est sit."", ""Non cumque similique omnis velit enim beatae commodi. Quam quo impedit ullam odit. Laudantium blanditiis consequatur veniam. Pariatur excepturi sit impedit iusto enim est. Velit soluta fuga."", ""Ut repudiandae deleniti minima. Consequatur ad similique et et rerum autem voluptates. Cupiditate magni nemo blanditiis aut eos maiores. Et exercitationem cumque qui est eaque. Labore optio adipisci natus."", ""Soluta officia omnis pariatur. Recusandae saepe qui earum nesciunt voluptas. Voluptas aut repellat. Et commodi voluptatem ex dolore pariatur nisi sequi.""]",beach.jpg
Id fugiat sit.,Miss Jabari White,"[""Ea soluta fuga culpa dolores. Id vel tempore quia voluptas qui quasi. Aliquam libero sunt. Magni qui est incidunt impedit a distinctio sit. Voluptatem et laudantium nesciunt."", ""Aut sit consequatur magnam cupiditate. Est maxime cum consectetur libero dolore voluptates quo. Est excepturi et molestiae provident laudantium labore et."", ""Nam et dolor ut voluptatem aliquam vitae. Voluptatibus qui veritatis dolorum aliquam quas. Magni eius fugiat. Quidem enim et iure."", ""Aspernatur vel nulla molestiae sunt qui sapiente ex. Unde nesciunt sit quae aut accusamus veniam recusandae. Architecto non cum natus veniam inventore quasi temporibus. Expedita officia sint."", ""Quam et cupiditate excepturi nostrum. Quam sint commodi inventore quia ut quod. Aut necessitatibus eius. Dolore architecto iure deleniti temporibus ab consectetur quod."", ""Qui neque natus. Quia eveniet officiis iusto. At minima non. Aut vel voluptatem ratione."", ""Aliquid est eaque temporibus. Dolores error minus fugiat ut. In eveniet sit. Quidem vero qui ut."", ""Et deleniti dolore ea velit eos animi. Omnis distinctio ut. Sed qui voluptatem maiores officia quis. Eum omnis voluptatibus qui perspiciatis et. Aut sint occaecati nihil dignissimos aut assumenda et."", ""Qui accusamus sint ut ea. Nostrum cupiditate et omnis commodi quo. Aperiam aspernatur aut vitae consequatur.""]",beach.jpg
Nostrum perspiciatis qui qui quia quae.,Anibal Lind III,"[""Nesciunt occaecati et voluptatem. Voluptas at iste exercitationem dolores quas non. Iure eos quis. Quia reprehenderit omnis quo aut quo illo. Officia recusandae culpa."", ""Id non voluptatem. Incidunt minima aut aut est. Temporibus voluptatibus aut enim."", ""Consectetur quia vel delectus consequatur nisi beatae. Eum expedita iusto quas porro neque provident. Aut rem accusamus suscipit consectetur minus doloribus. Unde eos quo velit. Illo dignissimos nostrum quod molestiae."", ""Aperiam dolorum possimus nostrum consequatur. Aliquid ab dolores et. Voluptatem placeat recusandae. Quo nesciunt eaque aut nihil reprehenderit."", ""Atque nihil explicabo non fugit tempora est et. Nihil minus occaecati aut qui ducimus. Est magnam nulla dolor nisi dolores inventore. Magni accusamus rerum harum sunt architecto quis."", ""Qui non quod velit. Ad sunt quia tempora blanditiis quia est. Quidem officia et commodi."", ""Suscipit aspernatur animi quisquam. Illo ad et omnis ut sit. Maxime veritatis incidunt libero veniam. Veniam quaerat cum sunt. Ut eum id illo exercitationem."", ""Excepturi dolore incidunt iure. Et commodi nisi sed. Qui sit rem non neque omnis dolor repudiandae. Aliquid cumque ut dicta itaque eveniet commodi et. Eum commodi sint.""]",beach.jpg
Ad dolorem dolores.,Claudia Dare,"[""At perferendis voluptatibus neque necessitatibus ad. Autem dicta iste. Provident earum autem velit. Illo sapiente veritatis eos sint et animi."", ""Dicta eius qui aliquam repudiandae et. Est illo deleniti sit id animi. Hic ad rerum. Cum laboriosam accusamus. Qui porro odit corrupti ex voluptatem."", ""Veniam ipsum sit nihil quisquam ad suscipit sapiente. Consequatur quis quia veritatis. Qui ipsum est exercitationem necessitatibus officiis aut. Eos consequatur sint sapiente magni est quae. Repellendus debitis voluptates omnis nemo quia."", ""Quisquam quas sit suscipit aut enim ad rem. Tenetur dicta ab amet quia placeat. Laudantium in et. Quia pariatur perferendis quia iste ullam deserunt et. Aut ratione sint earum aut qui et qui."", ""Ad nulla est voluptates corporis aspernatur incidunt ea. Enim corrupti pariatur. Inventore ratione non quisquam reiciendis consectetur."", ""Illo earum voluptates ipsam est repellendus. In similique maiores explicabo vitae saepe cum. Reprehenderit nihil inventore dolorem dolor magni. Nihil saepe et quia consequatur labore. Nisi tenetur eveniet aut nihil sit veniam voluptatem."", ""Illo quidem officiis ratione est accusamus cupiditate aut. Officia omnis rem est laborum pariatur. Exercitationem dolores voluptas iste natus assumenda."", ""Non enim voluptatum molestias minus. Odio numquam sunt dolor. Dicta consequuntur deleniti.""]",beach.jpg
